### ISSUE TITLE
io: read/write on closed pipe

### ISSUE THREAD

**Issue by NotABaguette** [hanselime/paqet#32]
**Describe the bug**
When installing a fresh server/client pair, for the first couple minutes, the traffic is good and everything works, after that, errors pile as below:

```
Feb 03 10:42:45 SERVER_NAME paqet[5469]: 2026-02-03 10:42:45.687 [ERROR] failed to accept stream on CLIENT_IP:61930: io: read/write on closed pipe
Feb 03 10:42:56 SERVER_NAME paqet[5469]: 2026-02-03 10:42:56.280 [ERROR] failed to read protocol message from stream 41: EOF
Feb 03 10:42:56 SERVER_NAME paqet[5469]: 2026-02-03 10:42:56.280 [ERROR] stream 41 from CLIENT_IP:38671 closed with error: EOF
Feb 03 10:42:56 SERVER_NAME paqet[5469]: 2026-02-03 10:42:56.280 [ERROR] TCP stream 25 to XXX.com:443 failed: EOF

```

**To Reproduce**
1. Downloaded the latest release
2. Generate a cryptographic safe key
3. add iptable rules for the specified port and save them.
4. create the server config accordingly
5. start up the server
6. same for client-side

**Expected behavior**
Traffic starts to flow without unexpected EOF and without ```closed with error: io: read/write on closed pipe``` errors

**Operating System**
 - OS: Ubuntu
 - Version 24.04

**Application Version**
- Version: v1.0.0-alpha.12

**IPTables rules**
```
*mangle
:PREROUTING ACCEPT [0:0]
:INPUT ACCEPT [0:0]
:FORWARD ACCEPT [0:0]
:OUTPUT ACCEPT [246423:31025942]
:POSTROUTING ACCEPT [0:0]
-A OUTPUT -p tcp -m tcp --sport SERVER_PORT --tcp-flags RST RST -j DROP
COMMIT

*raw
:PREROUTING ACCEPT [406371:580604266]
:OUTPUT ACCEPT [347635:35074422]
-A PREROUTING -p tcp -m tcp --dport SERVER_PORT -j NOTRACK
-A OUTPUT -p tcp -m tcp --sport SERVER_PORT -j NOTRACK
COMMIT

*filter
:INPUT ACCEPT [406294:580584240]
:FORWARD ACCEPT [0:0]
:OUTPUT ACCEPT [246423:31025942]
-A INPUT -p tcp -m tcp --dport SERVER_PORT -j ACCEPT
-A OUTPUT -p tcp -m tcp --sport SERVER_PORT -j ACCEPT
COMMIT
```

**Client Configuration**
```yaml
role: "client"

log:
  level: "debug"

socks5:
  - listen: "127.0.0.1:1080"

network:
  interface: "eth0"
  ipv4:
    addr: "CLIENT_IP:0"
    router_mac: "GATEWAY MAC FROM ARP TABLE"
  tcp:
    local_flag: ["PA"]
    remote_flag: ["PA"]
  pcap:
    sockbuf: 4194304

server:
  addr: "SERVER_IP:SERVER PORT"

transport:
  protocol: "kcp"
  conn: 1
  kcp:
    mode: "fast"
    mtu: 1350
    rcvwnd: 512
    sndwnd: 512
    block: "aes"
    key: "KEY"
    smuxbuf: 4194304
    streambuf: 2097152
```

**Server Configuration**
```yaml
role: "server"

log:
  level: "debug"

listen:
  addr: ":PORT HERE"

network:
  interface: "eth0"
  ipv4:
    addr: "SERVER_IP:PORT HERE"
    router_mac: "GATEWAY MAC FROM ARP TABLE"
  tcp:
    local_flag: ["PA"]
  pcap:
    sockbuf: 8388608

transport:
  protocol: "kcp"
  conn: 1
  kcp:
    mode: "fast"
    mtu: 1350
    rcvwnd: 1024
    sndwnd: 1024
    block: "aes"
    key: "KEY HERE"
    smuxbuf: 4194304
    streambuf: 2097152
```

**Client Log**
```
Feb 03 00:13:09 network paqet[217151]: 2026-02-03 00:13:09.681 [INFO] Starting client...
Feb 03 00:13:09 network paqet[217151]: 2026-02-03 00:13:09.682 [WARN] PCONN Port: 50970
Feb 03 00:13:09 network paqet[217151]: 2026-02-03 00:13:09.767 [DEBUG] KCP connection established, creating smux session
Feb 03 00:13:09 network paqet[217151]: 2026-02-03 00:13:09.767 [DEBUG] smux session established successfully
Feb 03 00:13:09 network paqet[217151]: 2026-02-03 00:13:09.768 [DEBUG] client connection 1 established successfully
Feb 03 00:13:09 network paqet[217151]: 2026-02-03 00:13:09.768 [INFO] Client started: IPv4:CLIENT_IP IPv6:<nil> -> SERVER_IP:SERVER PORT (1 connections)
Feb 03 00:13:09 network paqet[217151]: 2026-02-03 00:13:09.768 [INFO] SOCKS5 server listening on 127.0.0.1:1080
Feb 03 00:13:18 network paqet[217151]: 2026-02-03 00:13:18.340 [DEBUG] SOCKS5 CONNECT from 127.0.0.1:39168 to httpbin.org:443
Feb 03 00:13:18 network paqet[217151]: 2026-02-03 00:13:18.341 [INFO] SOCKS5 accepted TCP connection 127.0.0.1:39168 -> httpbin.org:443
Feb 03 00:13:18 network paqet[217151]: 2026-02-03 00:13:18.346 [DEBUG] TCP stream 9 established for httpbin.org:443
Feb 03 00:13:18 network paqet[217151]: 2026-02-03 00:13:18.346 [DEBUG] SOCKS5 stream 9 established for 127.0.0.1:39168 -> httpbin.org:443
Feb 03 00:13:19 network paqet[217151]: 2026-02-03 00:13:19.234 [DEBUG] SOCKS5 connection 127.0.0.1:39168 -> httpbin.org:443 closed
Feb 03 00:23:48 network paqet[217151]: 2026-02-03 00:23:48.881 [DEBUG] SOCKS5 CONNECT from 127.0.0.1:52324 to httpbin.org:443
Feb 03 00:23:48 network paqet[217151]: 2026-02-03 00:23:48.882 [INFO] SOCKS5 accepted TCP connection 127.0.0.1:52324 -> httpbin.org:443
Feb 03 00:23:48 network paqet[217151]: 2026-02-03 00:23:48.893 [DEBUG] TCP stream 15 established for httpbin.org:443
Feb 03 00:23:48 network paqet[217151]: 2026-02-03 00:23:48.893 [DEBUG] SOCKS5 stream 15 established for 127.0.0.1:52324 -> httpbin.org:443
Feb 03 00:23:49 network paqet[217151]: 2026-02-03 00:23:49.794 [DEBUG] SOCKS5 connection 127.0.0.1:52324 -> httpbin.org:443 closed
Feb 03 00:26:45 network paqet[217151]: 2026-02-03 00:26:45.028 [DEBUG] SOCKS5 CONNECT from 127.0.0.1:46478 to websitereview.corp.apple.com:443
Feb 03 00:26:45 network paqet[217151]: 2026-02-03 00:26:45.028 [INFO] SOCKS5 accepted TCP connection 127.0.0.1:46478 -> websitereview.corp.apple.com:443
Feb 03 00:26:45 network paqet[217151]: 2026-02-03 00:26:45.034 [DEBUG] TCP stream 21 established for websitereview.corp.apple.com:443
Feb 03 00:26:45 network paqet[217151]: 2026-02-03 00:26:45.034 [DEBUG] SOCKS5 stream 21 established for 127.0.0.1:46478 -> websitereview.corp.apple.com:443
Feb 03 00:26:45 network paqet[217151]: 2026-02-03 00:26:45.191 [ERROR] SOCKS5 stream 21 failed for 127.0.0.1:46478 -> websitereview.corp.apple.com:443: EOF
Feb 03 00:26:45 network paqet[217151]: 2026-02-03 00:26:45.191 [DEBUG] SOCKS5 connection 127.0.0.1:46478 -> websitereview.corp.apple.com:443 closed
Feb 03 00:26:45 network paqet[217151]: 2026-02-03 00:26:45.903 [DEBUG] SOCKS5 UDP_ASSOCIATE from 127.0.0.1:54988
Feb 03 00:26:45 network paqet[217151]: 2026-02-03 00:26:45.903 [DEBUG] SOCKS5 accepted UDP_ASSOCIATE from 127.0.0.1:54988, waiting for TCP connection to close
Feb 03 00:26:45 network paqet[217151]: 2026-02-03 00:26:45.905 [DEBUG] SOCKS5 UDP_ASSOCIATE from 127.0.0.1:54996
Feb 03 00:26:45 network paqet[217151]: 2026-02-03 00:26:45.905 [DEBUG] SOCKS5 accepted UDP_ASSOCIATE from 127.0.0.1:54996, waiting for TCP connection to close
Feb 03 00:26:45 network paqet[217151]: 2026-02-03 00:26:45.942 [DEBUG] established UDP stream 27 for 127.0.0.1:53084 -> whatismyipaddress.com:443
Feb 03 00:26:45 network paqet[217151]: 2026-02-03 00:26:45.943 [INFO] SOCKS5 accepted UDP connection 127.0.0.1:53084 -> whatismyipaddress.com:443
Feb 03 00:26:45 network paqet[217151]: 2026-02-03 00:26:45.943 [DEBUG] established UDP stream 37 for 127.0.0.1:47735 -> www.google.com:443
Feb 03 00:26:45 network paqet[217151]: 2026-02-03 00:26:45.944 [INFO] SOCKS5 accepted UDP connection 127.0.0.1:47735 -> www.google.com:443
Feb 03 00:26:45 network paqet[217151]: 2026-02-03 00:26:45.944 [DEBUG] established UDP stream 41 for 127.0.0.1:53084 -> whatismyipaddress.com:443
Feb 03 00:26:45 network paqet[217151]: 2026-02-03 00:26:45.944 [INFO] SOCKS5 accepted UDP connection 127.0.0.1:53084 -> whatismyipaddress.com:443
Feb 03 00:26:45 network paqet[217151]: 2026-02-03 00:26:45.944 [DEBUG] established UDP stream 45 for 127.0.0.1:47735 -> www.google.com:443
Feb 03 00:26:45 network paqet[217151]: 2026-02-03 00:26:45.944 [INFO] SOCKS5 accepted UDP connection 127.0.0.1:47735 -> www.google.com:443
Feb 03 00:26:46 network paqet[217151]: 2026-02-03 00:26:46.402 [DEBUG] SOCKS5 UDP_ASSOCIATE from 127.0.0.1:55008
Feb 03 00:26:46 network paqet[217151]: 2026-02-03 00:26:46.403 [DEBUG] SOCKS5 accepted UDP_ASSOCIATE from 127.0.0.1:55008, waiting for TCP connection to close
Feb 03 00:26:46 network paqet[217151]: 2026-02-03 00:26:46.415 [DEBUG] SOCKS5 UDP_ASSOCIATE from 127.0.0.1:55016
Feb 03 00:26:46 network paqet[217151]: 2026-02-03 00:26:46.416 [DEBUG] SOCKS5 accepted UDP_ASSOCIATE from 127.0.0.1:55016, waiting for TCP connection to close
Feb 03 00:26:46 network paqet[217151]: 2026-02-03 00:26:46.427 [DEBUG] established UDP stream 51 for 127.0.0.1:40244 -> www.google.com:443
Feb 03 00:26:46 network paqet[217151]: 2026-02-03 00:26:46.430 [INFO] SOCKS5 accepted UDP connection 127.0.0.1:40244 -> www.google.com:443
Feb 03 00:26:46 network paqet[217151]: 2026-02-03 00:26:46.431 [DEBUG] established UDP stream 57 for 127.0.0.1:40244 -> www.google.com:443
Feb 03 00:26:46 network paqet[217151]: 2026-02-03 00:26:46.432 [INFO] SOCKS5 accepted UDP connection 127.0.0.1:40244 -> www.google.com:443
Feb 03 00:26:46 network paqet[217151]: 2026-02-03 00:26:46.432 [DEBUG] established UDP stream 63 for 127.0.0.1:40244 -> www.google.com:443
Feb 03 00:26:46 network paqet[217151]: 2026-02-03 00:26:46.432 [INFO] SOCKS5 accepted UDP connection 127.0.0.1:40244 -> www.google.com:443
Feb 03 00:26:46 network paqet[217151]: 2026-02-03 00:26:46.432 [DEBUG] established UDP stream 69 for 127.0.0.1:40244 -> www.google.com:443
Feb 03 00:26:46 network paqet[217151]: 2026-02-03 00:26:46.433 [INFO] SOCKS5 accepted UDP connection 127.0.0.1:40244 -> www.google.com:443
Feb 03 00:26:46 network paqet[217151]: 2026-02-03 00:26:46.433 [DEBUG] established UDP stream 75 for 127.0.0.1:40244 -> www.google.com:443
Feb 03 00:26:46 network paqet[217151]: 2026-02-03 00:26:46.433 [INFO] SOCKS5 accepted UDP connection 127.0.0.1:40244 -> www.google.com:443
```

**Server Log**
```
Feb 03 10:47:30 SERVER_NAME paqet[5469]: 2026-02-03 10:47:30.711 [ERROR] failed to read protocol message from stream 29: io: read/write on closed pipe
Feb 03 10:47:30 SERVER_NAME paqet[5469]: 2026-02-03 10:47:30.711 [ERROR] stream 29 from CLIENT IP:40700 closed with error: io: read/write on closed pipe
Feb 03 10:47:32 SERVER_NAME paqet[5469]: 2026-02-03 10:47:32.888 [INFO] accepted new connection from CLIENT IP:40700 (local: %!s(<nil>))
Feb 03 10:47:40 SERVER_NAME paqet[5469]: 2026-02-03 10:47:40.889 [ERROR] failed to accept stream on CLIENT IP:40700: io: read/write on closed pipe
Feb 03 10:47:46 SERVER_NAME paqet[5469]: 2026-02-03 10:47:46.751 [INFO] accepted new connection from CLIENT IP:55758 (local: %!s(<nil>))
Feb 03 10:47:46 SERVER_NAME paqet[5469]: 2026-02-03 10:47:46.865 [ERROR] failed to read protocol message from stream 5: EOF
Feb 03 10:47:46 SERVER_NAME paqet[5469]: 2026-02-03 10:47:46.865 [ERROR] stream 5 from CLIENT IP:55758 closed with error: EOF
Feb 03 10:47:46 SERVER_NAME paqet[5469]: 2026-02-03 10:47:46.865 [ERROR] failed to read protocol message from stream 11: EOF
Feb 03 10:47:46 SERVER_NAME paqet[5469]: 2026-02-03 10:47:46.865 [ERROR] stream 11 from CLIENT IP:55758 closed with error: EOF
Feb 03 10:47:46 SERVER_NAME paqet[5469]: 2026-02-03 10:47:46.865 [ERROR] failed to read protocol message from stream 17: EOF
Feb 03 10:47:46 SERVER_NAME paqet[5469]: 2026-02-03 10:47:46.865 [ERROR] stream 17 from CLIENT IP:55758 closed with error: EOF
Feb 03 10:47:46 SERVER_NAME paqet[5469]: 2026-02-03 10:47:46.865 [ERROR] failed to read protocol message from stream 23: EOF
Feb 03 10:47:46 SERVER_NAME paqet[5469]: 2026-02-03 10:47:46.865 [ERROR] stream 23 from CLIENT IP:55758 closed with error: EOF
Feb 03 10:47:46 SERVER_NAME paqet[5469]: 2026-02-03 10:47:46.865 [ERROR] failed to read protocol message from stream 29: EOF
Feb 03 10:47:46 SERVER_NAME paqet[5469]: 2026-02-03 10:47:46.865 [ERROR] stream 29 from CLIENT IP:55758 closed with error: EOF
Feb 03 10:47:46 SERVER_NAME paqet[5469]: 2026-02-03 10:47:46.866 [DEBUG] stream 3 from CLIENT IP:55758 closed
Feb 03 10:47:46 SERVER_NAME paqet[5469]: 2026-02-03 10:47:46.866 [INFO] accepted TCP stream 7: CLIENT IP:55758 -> 149.154.167.91:80
Feb 03 10:47:46 SERVER_NAME paqet[5469]: 2026-02-03 10:47:46.867 [DEBUG] stream 9 from CLIENT IP:55758 closed
Feb 03 10:47:46 SERVER_NAME paqet[5469]: 2026-02-03 10:47:46.867 [INFO] accepted TCP stream 13: CLIENT IP:55758 -> 149.154.167.91:443
Feb 03 10:47:46 SERVER_NAME paqet[5469]: 2026-02-03 10:47:46.867 [DEBUG] stream 15 from CLIENT IP:55758 closed
Feb 03 10:47:46 SERVER_NAME paqet[5469]: 2026-02-03 10:47:46.867 [INFO] accepted TCP stream 19: CLIENT IP:55758 -> 149.154.167.91:80
Feb 03 10:47:46 SERVER_NAME paqet[5469]: 2026-02-03 10:47:46.867 [DEBUG] stream 21 from CLIENT IP:55758 closed
Feb 03 10:47:46 SERVER_NAME paqet[5469]: 2026-02-03 10:47:46.880 [DEBUG] TCP connection established to 149.154.167.91:80 for stream 7
Feb 03 10:47:46 SERVER_NAME paqet[5469]: 2026-02-03 10:47:46.880 [DEBUG] TCP connection established to 149.154.167.91:443 for stream 13
Feb 03 10:47:46 SERVER_NAME paqet[5469]: 2026-02-03 10:47:46.880 [ERROR] TCP stream 13 to 149.154.167.91:443 failed: EOF
Feb 03 10:47:46 SERVER_NAME paqet[5469]: 2026-02-03 10:47:46.880 [DEBUG] closed TCP connection 149.154.167.91:443 for stream 13
Feb 03 10:47:46 SERVER_NAME paqet[5469]: 2026-02-03 10:47:46.880 [ERROR] stream 13 from CLIENT IP:55758 closed with error: EOF
Feb 03 10:47:46 SERVER_NAME paqet[5469]: 2026-02-03 10:47:46.881 [DEBUG] TCP connection established to 149.154.167.91:80 for stream 19
Feb 03 10:48:02 SERVER_NAME paqet[5469]: 2026-02-03 10:48:02.752 [ERROR] failed to accept stream on CLIENT IP:55758: io: read/write on closed pipe
Feb 03 10:48:02 SERVER_NAME paqet[5469]: 2026-02-03 10:48:02.752 [ERROR] TCP stream 19 to 149.154.167.91:80 failed: io: read/write on closed pipe
Feb 03 10:48:02 SERVER_NAME paqet[5469]: 2026-02-03 10:48:02.752 [DEBUG] closed TCP connection 149.154.167.91:80 for stream 19
Feb 03 10:48:02 SERVER_NAME paqet[5469]: 2026-02-03 10:48:02.752 [ERROR] stream 19 from CLIENT IP:55758 closed with error: io: read/write on closed pipe
Feb 03 10:48:02 SERVER_NAME paqet[5469]: 2026-02-03 10:48:02.752 [ERROR] failed to read protocol message from stream 33: io: read/write on closed pipe
Feb 03 10:48:02 SERVER_NAME paqet[5469]: 2026-02-03 10:48:02.752 [ERROR] stream 33 from CLIENT IP:55758 closed with error: io: read/write on closed pipe
Feb 03 10:48:02 SERVER_NAME paqet[5469]: 2026-02-03 10:48:02.752 [ERROR] TCP stream 7 to 149.154.167.91:80 failed: io: read/write on closed pipe
Feb 03 10:48:02 SERVER_NAME paqet[5469]: 2026-02-03 10:48:02.752 [DEBUG] closed TCP connection 149.154.167.91:80 for stream 7
Feb 03 10:48:02 SERVER_NAME paqet[5469]: 2026-02-03 10:48:02.752 [ERROR] stream 7 from CLIENT IP:55758 closed with error: io: read/write on closed pipe
Feb 03 10:48:02 SERVER_NAME paqet[5469]: 2026-02-03 10:48:02.752 [ERROR] failed to read protocol message from stream 25: io: read/write on closed pipe
Feb 03 10:48:02 SERVER_NAME paqet[5469]: 2026-02-03 10:48:02.752 [ERROR] stream 25 from CLIENT IP:55758 closed with error: io: read/write on closed pipe
Feb 03 10:48:02 SERVER_NAME paqet[5469]: 2026-02-03 10:48:02.752 [ERROR] failed to read protocol message from stream 27: io: read/write on closed pipe
Feb 03 10:48:02 SERVER_NAME paqet[5469]: 2026-02-03 10:48:02.752 [ERROR] stream 27 from CLIENT IP:55758 closed with error: io: read/write on closed pipe
Feb 03 10:48:02 SERVER_NAME paqet[5469]: 2026-02-03 10:48:02.752 [ERROR] failed to read protocol message from stream 31: io: read/write on closed pipe
Feb 03 10:48:02 SERVER_NAME paqet[5469]: 2026-02-03 10:48:02.752 [ERROR] stream 31 from CLIENT IP:55758 closed with error: io: read/write on closed pipe
Feb 03 10:48:02 SERVER_NAME paqet[5469]: 2026-02-03 10:48:02.809 [INFO] accepted new connection from CLIENT IP:55758 (local: %!s(<nil>))
Feb 03 10:48:10 SERVER_NAME paqet[5469]: 2026-02-03 10:48:10.810 [ERROR] failed to accept stream on CLIENT IP:55758: io: read/write on closed pipe
Feb 03 10:48:11 SERVER_NAME paqet[5469]: 2026-02-03 10:48:11.789 [INFO] accepted new connection from CLIENT IP:55758 (local: %!s(<nil>))
Feb 03 10:48:18 SERVER_NAME paqet[5469]: 2026-02-03 10:48:18.768 [INFO] accepted new connection from CLIENT IP:37593 (local: %!s(<nil>))
Feb 03 10:48:18 SERVER_NAME paqet[5469]: 2026-02-03 10:48:18.882 [ERROR] failed to read protocol message from stream 5: EOF
Feb 03 10:48:18 SERVER_NAME paqet[5469]: 2026-02-03 10:48:18.882 [ERROR] stream 5 from CLIENT IP:37593 closed with error: EOF
Feb 03 10:48:18 SERVER_NAME paqet[5469]: 2026-02-03 10:48:18.882 [ERROR] failed to read protocol message from stream 11: EOF
Feb 03 10:48:18 SERVER_NAME paqet[5469]: 2026-02-03 10:48:18.882 [ERROR] stream 11 from CLIENT IP:37593 closed with error: EOF
Feb 03 10:48:18 SERVER_NAME paqet[5469]: 2026-02-03 10:48:18.882 [ERROR] failed to read protocol message from stream 17: EOF
Feb 03 10:48:18 SERVER_NAME paqet[5469]: 2026-02-03 10:48:18.882 [ERROR] stream 17 from CLIENT IP:37593 closed with error: EOF
Feb 03 10:48:18 SERVER_NAME paqet[5469]: 2026-02-03 10:48:18.882 [ERROR] failed to read protocol message from stream 23: EOF
Feb 03 10:48:18 SERVER_NAME paqet[5469]: 2026-02-03 10:48:18.882 [ERROR] stream 23 from CLIENT IP:37593 closed with error: EOF
Feb 03 10:48:18 SERVER_NAME paqet[5469]: 2026-02-03 10:48:18.882 [ERROR] failed to read protocol message from stream 29: EOF
Feb 03 10:48:18 SERVER_NAME paqet[5469]: 2026-02-03 10:48:18.882 [ERROR] stream 29 from CLIENT IP:37593 closed with error: EOF
Feb 03 10:48:18 SERVER_NAME paqet[5469]: 2026-02-03 10:48:18.882 [ERROR] failed to read protocol message from stream 35: EOF
Feb 03 10:48:18 SERVER_NAME paqet[5469]: 2026-02-03 10:48:18.882 [ERROR] stream 35 from CLIENT IP:37593 closed with error: EOF
Feb 03 10:48:18 SERVER_NAME paqet[5469]: 2026-02-03 10:48:18.882 [DEBUG] stream 3 from CLIENT IP:37593 closed
Feb 03 10:48:18 SERVER_NAME paqet[5469]: 2026-02-03 10:48:18.882 [INFO] accepted TCP stream 7: CLIENT IP:37593 -> 149.154.167.91:5222
Feb 03 10:48:18 SERVER_NAME paqet[5469]: 2026-02-03 10:48:18.883 [DEBUG] stream 9 from CLIENT IP:37593 closed
Feb 03 10:48:18 SERVER_NAME paqet[5469]: 2026-02-03 10:48:18.883 [INFO] accepted TCP stream 13: CLIENT IP:37593 -> 149.154.167.91:80
Feb 03 10:48:18 SERVER_NAME paqet[5469]: 2026-02-03 10:48:18.883 [DEBUG] stream 15 from CLIENT IP:37593 closed
Feb 03 10:48:18 SERVER_NAME paqet[5469]: 2026-02-03 10:48:18.883 [INFO] accepted TCP stream 19: CLIENT IP:37593 -> 149.154.167.91:5222
Feb 03 10:48:18 SERVER_NAME paqet[5469]: 2026-02-03 10:48:18.884 [DEBUG] stream 21 from CLIENT IP:37593 closed
Feb 03 10:48:18 SERVER_NAME paqet[5469]: 2026-02-03 10:48:18.884 [INFO] accepted TCP stream 25: CLIENT IP:37593 -> gateway.icloud.com:443
Feb 03 10:48:18 SERVER_NAME paqet[5469]: 2026-02-03 10:48:18.885 [DEBUG] stream 27 from CLIENT IP:37593 closed
Feb 03 10:48:18 SERVER_NAME paqet[5469]: 2026-02-03 10:48:18.896 [DEBUG] TCP connection established to 149.154.167.91:80 for stream 13
Feb 03 10:48:18 SERVER_NAME paqet[5469]: 2026-02-03 10:48:18.896 [ERROR] TCP stream 13 to 149.154.167.91:80 failed: EOF
Feb 03 10:48:18 SERVER_NAME paqet[5469]: 2026-02-03 10:48:18.896 [DEBUG] closed TCP connection 149.154.167.91:80 for stream 13
Feb 03 10:48:18 SERVER_NAME paqet[5469]: 2026-02-03 10:48:18.896 [ERROR] stream 13 from CLIENT IP:37593 closed with error: EOF
Feb 03 10:48:18 SERVER_NAME paqet[5469]: 2026-02-03 10:48:18.897 [DEBUG] TCP connection established to 149.154.167.91:5222 for stream 7
Feb 03 10:48:18 SERVER_NAME paqet[5469]: 2026-02-03 10:48:18.897 [ERROR] TCP stream 7 to 149.154.167.91:5222 failed: EOF
Feb 03 10:48:18 SERVER_NAME paqet[5469]: 2026-02-03 10:48:18.897 [DEBUG] closed TCP connection 149.154.167.91:5222 for stream 7
Feb 03 10:48:18 SERVER_NAME paqet[5469]: 2026-02-03 10:48:18.897 [ERROR] stream 7 from CLIENT IP:37593 closed with error: EOF
Feb 03 10:48:18 SERVER_NAME paqet[5469]: 2026-02-03 10:48:18.897 [DEBUG] TCP connection established to 149.154.167.91:5222 for stream 19
Feb 03 10:48:18 SERVER_NAME paqet[5469]: 2026-02-03 10:48:18.897 [ERROR] TCP stream 19 to 149.154.167.91:5222 failed: EOF
Feb 03 10:48:18 SERVER_NAME paqet[5469]: 2026-02-03 10:48:18.897 [DEBUG] closed TCP connection 149.154.167.91:5222 for stream 19
Feb 03 10:48:18 SERVER_NAME paqet[5469]: 2026-02-03 10:48:18.897 [ERROR] stream 19 from CLIENT IP:37593 closed with error: EOF
Feb 03 10:48:18 SERVER_NAME paqet[5469]: 2026-02-03 10:48:18.916 [DEBUG] TCP connection established to gateway.icloud.com:443 for stream 25
Feb 03 10:48:19 SERVER_NAME paqet[5469]: 2026-02-03 10:48:19.790 [ERROR] failed to accept stream on CLIENT IP:55758: io: read/write on closed pipe
Feb 03 10:48:34 SERVER_NAME paqet[5469]: 2026-02-03 10:48:34.769 [ERROR] failed to accept stream on CLIENT IP:37593: io: read/write on closed pipe
Feb 03 10:48:34 SERVER_NAME paqet[5469]: 2026-02-03 10:48:34.769 [ERROR] failed to read protocol message from stream 33: io: read/write on closed pipe
Feb 03 10:48:34 SERVER_NAME paqet[5469]: 2026-02-03 10:48:34.769 [ERROR] stream 33 from CLIENT IP:37593 closed with error: io: read/write on closed pipe
Feb 03 10:48:34 SERVER_NAME paqet[5469]: 2026-02-03 10:48:34.769 [ERROR] failed to read protocol message from stream 37: io: read/write on closed pipe
Feb 03 10:48:34 SERVER_NAME paqet[5469]: 2026-02-03 10:48:34.769 [ERROR] stream 37 from CLIENT IP:37593 closed with error: io: read/write on closed pipe
Feb 03 10:48:34 SERVER_NAME paqet[5469]: 2026-02-03 10:48:34.769 [ERROR] failed to read protocol message from stream 41: io: read/write on closed pipe
Feb 03 10:48:34 SERVER_NAME paqet[5469]: 2026-02-03 10:48:34.769 [ERROR] stream 41 from CLIENT IP:37593 closed with error: io: read/write on closed pipe
Feb 03 10:48:34 SERVER_NAME paqet[5469]: 2026-02-03 10:48:34.769 [ERROR] TCP stream 25 to gateway.icloud.com:443 failed: io: read/write on closed pipe
Feb 03 10:48:34 SERVER_NAME paqet[5469]: 2026-02-03 10:48:34.769 [DEBUG] closed TCP connection gateway.icloud.com:443 for stream 25
Feb 03 10:48:34 SERVER_NAME paqet[5469]: 2026-02-03 10:48:34.769 [ERROR] stream 25 from CLIENT IP:37593 closed with error: io: read/write on closed pipe
Feb 03 10:48:34 SERVER_NAME paqet[5469]: 2026-02-03 10:48:34.769 [ERROR] failed to read protocol message from stream 31: io: read/write on closed pipe
Feb 03 10:48:34 SERVER_NAME paqet[5469]: 2026-02-03 10:48:34.769 [ERROR] stream 31 from CLIENT IP:37593 closed with error: io: read/write on closed pipe
Feb 03 10:48:34 SERVER_NAME paqet[5469]: 2026-02-03 10:48:34.769 [ERROR] failed to read protocol message from stream 39: io: read/write on closed pipe
Feb 03 10:48:34 SERVER_NAME paqet[5469]: 2026-02-03 10:48:34.769 [ERROR] stream 39 from CLIENT IP:37593 closed with error: io: read/write on closed pipe
Feb 03 10:48:36 SERVER_NAME paqet[5469]: 2026-02-03 10:48:36.030 [INFO] accepted new connection from CLIENT IP:37593 (local: %!s(<nil>))
Feb 03 10:48:44 SERVER_NAME paqet[5469]: 2026-02-03 10:48:44.031 [ERROR] failed to accept stream on CLIENT IP:37593: io: read/write on closed pipe
Feb 03 10:48:48 SERVER_NAME paqet[5469]: 2026-02-03 10:48:48.761 [INFO] accepted new connection from CLIENT IP:37593 (local: %!s(<nil>))
Feb 03 10:48:56 SERVER_NAME paqet[5469]: 2026-02-03 10:48:56.761 [ERROR] failed to accept stream on CLIENT IP:37593: io: read/write on closed pipe
```

**Additional context**
Everything works for the first couple minutes, but not after that. Also tried with different ISPs for client side, in some of them, the packets never reach the server, but with ```nc SERVER_IP PORT``` the dump on the server shows packets, but not the pings sent from paqet file on client, and on the rest of the clients everything works but only for the first couple minutes, after that, errors come

**Comment by hanselime** [comment]
Those errors look like normal connection-drop errors. Different ISPs and data centers can behave differently, but based on the logs it appears that packets are reaching your server, while packets sent from the server to the client are not reaching the client.

Could you run tcpdump on both the server and the client to check how the packets are flowing? You can use the following commands.

Client
```
tcpdump -i eth0 tcp and host SERVER_IP -n
```

Server
```
tcpdump -i eth0 tcp and port SERVER_PORT -n
```

**Comment by NotABaguette** [comment]
Sure,

** Client tcpdump **
```
tcpdump: verbose output suppressed, use -v[v]... for full protocol decode
listening on eth0, link-type EN10MB (Ethernet), snapshot length 262144 bytes
14:48:15.400859 IP CLIENT IP.37567 > SERVER IP.443: Flags [P.], seq 590969529:590970690, ack 590970928, win 65535, options [nop,nop,TS val 590969401 ecr 590969350], length 1161
14:48:15.400924 IP CLIENT IP.37567 > SERVER IP.443: Flags [P.], seq 128:550, ack 128, win 65535, options [nop,nop,TS val 590969401 ecr 590969349], length 422
14:48:15.508780 IP SERVER IP.443 > CLIENT IP.37567: Flags [P.], seq 4294792120:4294792172, ack 4294794600, win 65535, options [nop,nop,TS val 590755086 ecr 590754918], length 52
14:48:15.522240 IP CLIENT IP.37567 > SERVER IP.443: Flags [P.], seq 256:1417, ack 255, win 65535, options [nop,nop,TS val 590969401 ecr 590969348], length 1161
14:48:15.629969 IP SERVER IP.443 > CLIENT IP.37567: Flags [P.], seq 4294792248:4294792364, ack 4294794727, win 65535, options [nop,nop,TS val 590755086 ecr 590754917], length 116
14:48:15.630437 IP CLIENT IP.37567 > SERVER IP.443: Flags [P.], seq 384:436, ack 382, win 65535, options [nop,nop,TS val 590969401 ecr 590969347], length 52
14:48:15.659908 IP SERVER IP.443 > CLIENT IP.37567: Flags [P.], seq 4294792376:4294792500, ack 4294794854, win 65535, options [nop,nop,TS val 590755087 ecr 590754917], length 124
14:48:15.673781 IP CLIENT IP.37567 > SERVER IP.443: Flags [P.], seq 512:564, ack 509, win 65535, options [nop,nop,TS val 590969401 ecr 590969346], length 52
14:48:15.781252 IP SERVER IP.443 > CLIENT IP.37567: Flags [P.], seq 4294792504:4294792645, ack 4294794981, win 65535, options [nop,nop,TS val 590755087 ecr 590754916], length 141
14:48:15.794957 IP CLIENT IP.37567 > SERVER IP.443: Flags [P.], seq 640:756, ack 636, win 65535, options [nop,nop,TS val 590969401 ecr 590969345], length 116
14:48:15.812142 IP SERVER IP.443 > CLIENT IP.37567: Flags [P.], seq 4294792632:4294792781, ack 4294795108, win 65535, options [nop,nop,TS val 590755087 ecr 590754915], length 149
14:48:15.825294 IP CLIENT IP.37567 > SERVER IP.443: Flags [P.], seq 768:820, ack 763, win 65535, options [nop,nop,TS val 590969401 ecr 590969344], length 52
14:48:15.886577 IP CLIENT IP.37567 > SERVER IP.443: Flags [P.], seq 896:1035, ack 890, win 65535, options [nop,nop,TS val 590969402 ecr 590969344], length 139
14:48:15.901926 IP SERVER IP.443 > CLIENT IP.37567: Flags [P.], seq 4294792760:4294792812, ack 4294795235, win 65535, options [nop,nop,TS val 590755087 ecr 590754914], length 52
14:48:15.902352 IP CLIENT IP.37567 > SERVER IP.443: Flags [P.], seq 1024:1694, ack 1017, win 65535, options [nop,nop,TS val 590969402 ecr 590969343], length 670
14:48:15.993488 IP SERVER IP.443 > CLIENT IP.37567: Flags [P.], seq 4294792888:4294792940, ack 4294795362, win 65535, options [nop,nop,TS val 590755087 ecr 590754913], length 52
14:48:16.024322 IP SERVER IP.443 > CLIENT IP.37567: Flags [P.], seq 4294793016:4294793655, ack 4294795489, win 65535, options [nop,nop,TS val 590755087 ecr 590754912], length 639
14:48:16.025121 IP CLIENT IP.37567 > SERVER IP.443: Flags [P.], seq 1152:1204, ack 1144, win 65535, options [nop,nop,TS val 590969402 ecr 590969342], length 52
14:48:16.025158 IP CLIENT IP.37567 > SERVER IP.443: Flags [P.], seq 1280:2441, ack 1271, win 65535, options [nop,nop,TS val 590969402 ecr 590969341], length 1161
14:48:16.025172 IP CLIENT IP.37567 > SERVER IP.443: Flags [P.], seq 1408:2569, ack 1398, win 65535, options [nop,nop,TS val 590969402 ecr 590969340], length 1161
14:48:16.025193 IP CLIENT IP.37567 > SERVER IP.443: Flags [P.], seq 1536:2697, ack 1525, win 65535, options [nop,nop,TS val 590969402 ecr 590969339], length 1161
14:48:16.132042 IP SERVER IP.443 > CLIENT IP.37567: Flags [P.], seq 4294793144:4294793273, ack 4294795616, win 65535, options [nop,nop,TS val 590755087 ecr 590754911], length 129
14:48:16.145619 IP SERVER IP.443 > CLIENT IP.37567: Flags [P.], seq 4294793272:4294793324, ack 4294795743, win 65535, options [nop,nop,TS val 590755087 ecr 590754910], length 52
14:48:16.145619 IP SERVER IP.443 > CLIENT IP.37567: Flags [P.], seq 4294793400:4294794039, ack 4294795870, win 65535, options [nop,nop,TS val 590755088 ecr 590754910], length 639
14:48:16.145619 IP SERVER IP.443 > CLIENT IP.37567: Flags [P.], seq 4294793528:4294794167, ack 4294795997, win 65535, options [nop,nop,TS val 590755088 ecr 590754909], length 639
14:48:16.145620 IP SERVER IP.443 > CLIENT IP.37567: Flags [P.], seq 4294793656:4294794295, ack 4294796124, win 65535, options [nop,nop,TS val 590755088 ecr 590754908], length 639
14:48:16.159773 IP CLIENT IP.37567 > SERVER IP.443: Flags [P.], seq 1664:1716, ack 1652, win 65535, options [nop,nop,TS val 590969402 ecr 590969338], length 52
14:48:16.175896 IP SERVER IP.443 > CLIENT IP.37567: Flags [P.], seq 4294793784:4294793951, ack 4294796251, win 65535, options [nop,nop,TS val 590755088 ecr 590754907], length 167
14:48:16.175896 IP SERVER IP.443 > CLIENT IP.37567: Flags [P.], seq 4294793912:4294795262, ack 4294796378, win 65535, options [nop,nop,TS val 590755088 ecr 590754906], length 1350
14:48:16.175896 IP SERVER IP.443 > CLIENT IP.37567: Flags [P.], seq 4294794040:4294795390, ack 4294796505, win 65535, options [nop,nop,TS val 590755088 ecr 590754905], length 1350
14:48:16.175897 IP SERVER IP.443 > CLIENT IP.37567: Flags [P.], seq 4294794168:4294794647, ack 4294796632, win 65535, options [nop,nop,TS val 590755088 ecr 590754904], length 479
14:48:16.175897 IP SERVER IP.443 > CLIENT IP.37567: Flags [P.], seq 4294794296:4294795646, ack 4294796759, win 65535, options [nop,nop,TS val 590755088 ecr 590754903], length 1350
14:48:16.175897 IP SERVER IP.443 > CLIENT IP.37567: Flags [P.], seq 4294794424:4294795774, ack 4294796886, win 65535, options [nop,nop,TS val 590755089 ecr 590754903], length 1350
14:48:16.175897 IP SERVER IP.443 > CLIENT IP.37567: Flags [P.], seq 4294794552:4294795669, ack 4294797013, win 65535, options [nop,nop,TS val 590755089 ecr 590754902], length 1117
14:48:16.190165 IP CLIENT IP.37567 > SERVER IP.443: Flags [P.], seq 1792:1844, ack 1779, win 65535, options [nop,nop,TS val 590969402 ecr 590969337], length 52
14:48:16.311480 IP CLIENT IP.37567 > SERVER IP.443: Flags [P.], seq 1920:2703, ack 1906, win 65535, options [nop,nop,TS val 590969403 ecr 590969337], length 783
14:48:16.330166 IP SERVER IP.443 > CLIENT IP.37567: Flags [P.], seq 4294794680:4294794809, ack 4294797140, win 65535, options [nop,nop,TS val 590755089 ecr 590754901], length 129
14:48:16.342319 IP CLIENT IP.37567 > SERVER IP.443: Flags [P.], seq 2048:2207, ack 2033, win 65535, options [nop,nop,TS val 590969403 ecr 590969336], length 159
14:48:16.373934 IP SERVER IP.443 > CLIENT IP.37567: Flags [P.], seq 4294794808:4294794975, ack 4294797267, win 65535, options [nop,nop,TS val 590755089 ecr 590754900], length 167
14:48:16.373934 IP SERVER IP.443 > CLIENT IP.37567: Flags [P.], seq 4294794936:4294796286, ack 4294797394, win 65535, options [nop,nop,TS val 590755089 ecr 590754899], length 1350
14:48:16.373935 IP SERVER IP.443 > CLIENT IP.37567: Flags [P.], seq 4294795064:4294796414, ack 4294797521, win 65535, options [nop,nop,TS val 590755089 ecr 590754898], length 1350
14:48:16.373935 IP SERVER IP.443 > CLIENT IP.37567: Flags [P.], seq 4294795192:4294796542, ack 4294797648, win 65535, options [nop,nop,TS val 590755089 ecr 590754897], length 1350
14:48:16.373935 IP SERVER IP.443 > CLIENT IP.37567: Flags [P.], seq 4294795320:4294796670, ack 4294797775, win 65535, options [nop,nop,TS val 590755089 ecr 590754896], length 1350
14:48:16.373935 IP SERVER IP.443 > CLIENT IP.37567: Flags [P.], seq 4294795448:4294796798, ack 4294797902, win 65535, options [nop,nop,TS val 590755090 ecr 590754896], length 1350
14:48:16.373935 IP SERVER IP.443 > CLIENT IP.37567: Flags [P.], seq 4294795576:4294796055, ack 4294798029, win 65535, options [nop,nop,TS val 590755090 ecr 590754895], length 479
14:48:16.373935 IP SERVER IP.443 > CLIENT IP.37567: Flags [P.], seq 4294795704:4294797054, ack 4294798156, win 65535, options [nop,nop,TS val 590755090 ecr 590754894], length 1350
14:48:16.374085 IP SERVER IP.443 > CLIENT IP.37567: Flags [P.], seq 4294795832:4294797182, ack 4294798283, win 65535, options [nop,nop,TS val 590755090 ecr 590754893], length 1350
14:48:16.374085 IP SERVER IP.443 > CLIENT IP.37567: Flags [P.], seq 4294795960:4294797077, ack 4294798410, win 65535, options [nop,nop,TS val 590755090 ecr 590754892], length 1117
14:48:16.403076 IP CLIENT IP.37567 > SERVER IP.443: Flags [P.], seq 2176:2228, ack 2160, win 65535, options [nop,nop,TS val 590969403 ecr 590969335], length 52
14:48:16.464670 IP CLIENT IP.37567 > SERVER IP.443: Flags [P.], seq 2304:2563, ack 2287, win 65535, options [nop,nop,TS val 590969403 ecr 590969334], length 259
14:48:16.726373 IP SERVER IP.443 > CLIENT IP.37567: Flags [P.], seq 4294796088:4294796217, ack 4294798537, win 65535, options [nop,nop,TS val 590755090 ecr 590754891], length 129
14:48:16.737133 IP CLIENT IP.37567 > SERVER IP.443: Flags [P.], seq 2432:2484, ack 2414, win 65535, options [nop,nop,TS val 590969403 ecr 590969333], length 52
14:48:16.769989 IP SERVER IP.443 > CLIENT IP.37567: Flags [P.], seq 4294796216:4294796383, ack 4294798664, win 65535, options [nop,nop,TS val 590755090 ecr 590754890], length 167
14:48:16.770323 IP SERVER IP.443 > CLIENT IP.37567: Flags [P.], seq 4294796344:4294797694, ack 4294798791, win 65535, options [nop,nop,TS val 590755090 ecr 590754889], length 1350
14:48:16.770323 IP SERVER IP.443 > CLIENT IP.37567: Flags [P.], seq 4294796472:4294797822, ack 4294798918, win 65535, options [nop,nop,TS val 590755091 ecr 590754889], length 1350
14:48:16.770323 IP SERVER IP.443 > CLIENT IP.37567: Flags [P.], seq 4294796600:4294797079, ack 4294799045, win 65535, options [nop,nop,TS val 590755091 ecr 590754888], length 479
14:48:16.770323 IP SERVER IP.443 > CLIENT IP.37567: Flags [P.], seq 4294796728:4294798078, ack 4294799172, win 65535, options [nop,nop,TS val 590755091 ecr 590754887], length 1350
14:48:16.770323 IP SERVER IP.443 > CLIENT IP.37567: Flags [P.], seq 4294796856:4294798206, ack 4294799299, win 65535, options [nop,nop,TS val 590755091 ecr 590754886], length 1350
14:48:16.770323 IP SERVER IP.443 > CLIENT IP.37567: Flags [P.], seq 4294796984:4294798334, ack 4294799426, win 65535, options [nop,nop,TS val 590755091 ecr 590754885], length 1350
14:48:16.770323 IP SERVER IP.443 > CLIENT IP.37567: Flags [P.], seq 4294797112:4294798462, ack 4294799553, win 65535, options [nop,nop,TS val 590755091 ecr 590754884], length 1350
14:48:16.770324 IP SERVER IP.443 > CLIENT IP.37567: Flags [P.], seq 4294797240:4294798590, ack 4294799680, win 65535, options [nop,nop,TS val 590755091 ecr 590754883], length 1350
14:48:16.770420 IP SERVER IP.443 > CLIENT IP.37567: Flags [P.], seq 4294797368:4294798485, ack 4294799807, win 65535, options [nop,nop,TS val 590755091 ecr 590754882], length 1117
14:48:16.798020 IP CLIENT IP.37567 > SERVER IP.443: Flags [P.], seq 2560:2612, ack 2541, win 65535, options [nop,nop,TS val 590969403 ecr 590969332], length 52
14:48:17.199435 IP CLIENT IP.37567 > SERVER IP.443: Flags [P.], seq 2688:3471, ack 2668, win 65535, options [nop,nop,TS val 590969403 ecr 590969331], length 783
14:48:17.230914 IP CLIENT IP.37567 > SERVER IP.443: Flags [P.], seq 2816:2951, ack 2795, win 65535, options [nop,nop,TS val 590969403 ecr 590969330], length 135
14:48:17.230973 IP CLIENT IP.37567 > SERVER IP.443: Flags [P.], seq 2944:3727, ack 2922, win 65535, options [nop,nop,TS val 590969404 ecr 590969330], length 783
14:48:17.230995 IP CLIENT IP.37567 > SERVER IP.443: Flags [P.], seq 3072:3855, ack 3049, win 65535, options [nop,nop,TS val 590969404 ecr 590969329], length 783
14:48:17.231010 IP CLIENT IP.37567 > SERVER IP.443: Flags [P.], seq 3200:3983, ack 3176, win 65535, options [nop,nop,TS val 590969404 ecr 590969328], length 783
14:48:17.320782 IP SERVER IP.443 > CLIENT IP.37567: Flags [P.], seq 4294797496:4294797625, ack 4294799934, win 65535, options [nop,nop,TS val 590755092 ecr 590754882], length 129
14:48:17.321626 IP CLIENT IP.37567 > SERVER IP.443: Flags [P.], seq 3328:3380, ack 3303, win 65535, options [nop,nop,TS val 590969404 ecr 590969327], length 52
14:48:17.352913 IP CLIENT IP.37567 > SERVER IP.443: Flags [P.], seq 3456:3715, ack 3430, win 65535, options [nop,nop,TS val 590969404 ecr 590969326], length 259
14:48:17.363263 IP SERVER IP.443 > CLIENT IP.37567: Flags [P.], seq 4294797624:4294797791, ack 4294800061, win 65535, options [nop,nop,TS val 590755092 ecr 590754881], length 167
14:48:17.363339 IP SERVER IP.443 > CLIENT IP.37567: Flags [P.], seq 4294797752:4294799102, ack 4294800188, win 65535, options [nop,nop,TS val 590755092 ecr 590754880], length 1350
14:48:17.363382 IP SERVER IP.443 > CLIENT IP.37567: Flags [P.], seq 4294797880:4294799230, ack 4294800315, win 65535, options [nop,nop,TS val 590755092 ecr 590754879], length 1350
14:48:17.363401 IP SERVER IP.443 > CLIENT IP.37567: Flags [P.], seq 4294798008:4294798487, ack 4294800442, win 65535, options [nop,nop,TS val 590755092 ecr 590754878], length 479
14:48:17.363425 IP SERVER IP.443 > CLIENT IP.37567: Flags [P.], seq 4294798136:4294799486, ack 4294800569, win 65535, options [nop,nop,TS val 590755092 ecr 590754877], length 1350
14:48:17.363449 IP SERVER IP.443 > CLIENT IP.37567: Flags [P.], seq 4294798264:4294799614, ack 4294800696, win 65535, options [nop,nop,TS val 590755092 ecr 590754876], length 1350
14:48:17.363512 IP SERVER IP.443 > CLIENT IP.37567: Flags [P.], seq 4294798392:4294799742, ack 4294800823, win 65535, options [nop,nop,TS val 590755092 ecr 590754875], length 1350
14:48:17.363512 IP SERVER IP.443 > CLIENT IP.37567: Flags [P.], seq 4294798520:4294799870, ack 4294800950, win 65535, options [nop,nop,TS val 590755093 ecr 590754875], length 1350
14:48:17.363512 IP SERVER IP.443 > CLIENT IP.37567: Flags [P.], seq 4294798648:4294799998, ack 4294801077, win 65535, options [nop,nop,TS val 590755093 ecr 590754874], length 1350
14:48:17.363541 IP SERVER IP.443 > CLIENT IP.37567: Flags [P.], seq 4294798776:4294799893, ack 4294801204, win 65535, options [nop,nop,TS val 590755093 ecr 590754873], length 1117
14:48:17.383406 IP CLIENT IP.37567 > SERVER IP.443: Flags [P.], seq 3584:3668, ack 3557, win 65535, options [nop,nop,TS val 590969404 ecr 590969325], length 84
14:48:17.474239 IP SERVER IP.443 > CLIENT IP.37567: Flags [P.], seq 4294798904:4294798980, ack 4294801331, win 65535, options [nop,nop,TS val 590755093 ecr 590754872], length 76
14:48:17.474801 IP CLIENT IP.37567 > SERVER IP.443: Flags [P.], seq 3712:4602, ack 3684, win 65535, options [nop,nop,TS val 590969404 ecr 590969324], length 890
14:48:17.514971 IP SERVER IP.443 > CLIENT IP.37567: Flags [P.], seq 4294799032:4294799092, ack 4294801458, win 65535, options [nop,nop,TS val 590755093 ecr 590754871], length 60
14:48:17.535216 IP CLIENT IP.37567 > SERVER IP.443: Flags [P.], seq 3840:3892, ack 3811, win 65535, options [nop,nop,TS val 590969404 ecr 590969323], length 52
14:48:17.713759 IP SERVER IP.443 > CLIENT IP.37567: Flags [P.], seq 4294799160:4294799220, ack 4294801585, win 65535, options [nop,nop,TS val 590755093 ecr 590754870], length 60
14:48:17.717199 IP CLIENT IP.37567 > SERVER IP.443: Flags [P.], seq 3968:4020, ack 3938, win 65535, options [nop,nop,TS val 590969405 ecr 590969323], length 52
14:48:18.109205 IP SERVER IP.443 > CLIENT IP.37567: Flags [P.], seq 4294799288:4294799348, ack 4294801712, win 65535, options [nop,nop,TS val 590755093 ecr 590754869], length 60
14:48:18.111362 IP CLIENT IP.37567 > SERVER IP.443: Flags [P.], seq 4096:4148, ack 4065, win 65535, options [nop,nop,TS val 590969405 ecr 590969322], length 52
14:48:18.245849 IP CLIENT IP.37567 > SERVER IP.443: Flags [P.], seq 4224:5114, ack 4192, win 65535, options [nop,nop,TS val 590969405 ecr 590969321], length 890
14:48:18.272341 IP CLIENT IP.37567 > SERVER IP.443: Flags [P.], seq 4352:4412, ack 4319, win 65535, options [nop,nop,TS val 590969405 ecr 590969320], length 60
14:48:18.704247 IP SERVER IP.443 > CLIENT IP.37567: Flags [P.], seq 4294799416:4294799476, ack 4294801839, win 65535, options [nop,nop,TS val 590755093 ecr 590754868], length 60
14:48:18.727247 IP CLIENT IP.37567 > SERVER IP.443: Flags [P.], seq 4480:4532, ack 4446, win 65535, options [nop,nop,TS val 590969405 ecr 590969319], length 52
14:48:18.727298 IP CLIENT IP.37567 > SERVER IP.443: Flags [P.], seq 4608:5498, ack 4573, win 65535, options [nop,nop,TS val 590969405 ecr 590969318], length 890
14:48:18.727316 IP CLIENT IP.37567 > SERVER IP.443: Flags [P.], seq 4736:5626, ack 4700, win 65535, options [nop,nop,TS val 590969405 ecr 590969317], length 890
14:48:18.727327 IP CLIENT IP.37567 > SERVER IP.443: Flags [P.], seq 4864:5754, ack 4827, win 65535, options [nop,nop,TS val 590969405 ecr 590969316], length 890
14:48:19.394122 IP CLIENT IP.37567 > SERVER IP.443: Flags [P.], seq 4992:5052, ack 4954, win 65535, options [nop,nop,TS val 590969406 ecr 590969316], length 60
14:48:19.497208 IP SERVER IP.443 > CLIENT IP.37567: Flags [P.], seq 4294799544:4294799604, ack 4294801966, win 65535, options [nop,nop,TS val 590755094 ecr 590754868], length 60
14:48:19.515470 IP CLIENT IP.37567 > SERVER IP.443: Flags [P.], seq 5120:5172, ack 5081, win 65535, options [nop,nop,TS val 590969406 ecr 590969315], length 52
14:48:19.527607 IP SERVER IP.443 > CLIENT IP.37567: Flags [P.], seq 4294799672:4294799732, ack 4294802093, win 65535, options [nop,nop,TS val 590755094 ecr 590754867], length 60
14:48:19.545764 IP CLIENT IP.37567 > SERVER IP.443: Flags [P.], seq 5248:5300, ack 5208, win 65535, options [nop,nop,TS val 590969406 ecr 590969314], length 52
14:48:19.726274 IP SERVER IP.443 > CLIENT IP.37567: Flags [P.], seq 4294799800:4294799860, ack 4294802220, win 65535, options [nop,nop,TS val 590755094 ecr 590754866], length 60
14:48:19.727554 IP CLIENT IP.37567 > SERVER IP.443: Flags [P.], seq 5376:5428, ack 5335, win 65535, options [nop,nop,TS val 590969406 ecr 590969313], length 52
14:48:19.787162 IP CLIENT IP.37567 > SERVER IP.443: Flags [P.], seq 5504:6394, ack 5462, win 65535, options [nop,nop,TS val 590969406 ecr 590969312], length 890
14:48:19.931671 IP CLIENT IP.37567 > SERVER IP.443: Flags [P.], seq 5632:5692, ack 5589, win 65535, options [nop,nop,TS val 590969406 ecr 590969311], length 60
14:48:20.123009 IP SERVER IP.443 > CLIENT IP.37567: Flags [P.], seq 4294799928:4294799988, ack 4294802347, win 65535, options [nop,nop,TS val 590755094 ecr 590754865], length 60
14:48:20.123010 IP SERVER IP.443 > CLIENT IP.37567: Flags [P.], seq 4294800056:4294801173, ack 4294802474, win 65535, options [nop,nop,TS val 590755094 ecr 590754864], length 1117
14:48:20.123010 IP SERVER IP.443 > CLIENT IP.37567: Flags [P.], seq 4294800184:4294801301, ack 4294802601, win 65535, options [nop,nop,TS val 590755094 ecr 590754863], length 1117
14:48:20.123010 IP SERVER IP.443 > CLIENT IP.37567: Flags [P.], seq 4294800312:4294801429, ack 4294802728, win 65535, options [nop,nop,TS val 590755094 ecr 590754862], length 1117
14:48:20.143584 IP CLIENT IP.37567 > SERVER IP.443: Flags [P.], seq 5760:5812, ack 5716, win 65535, options [nop,nop,TS val 590969406 ecr 590969310], length 52
14:48:20.165936 IP CLIENT IP.37567 > SERVER IP.443: Flags [P.], seq 5888:5948, ack 5843, win 65535, options [nop,nop,TS val 590969406 ecr 590969309], length 60
14:48:20.487485 IP SERVER IP.443 > CLIENT IP.37567: Flags [P.], seq 4294800440:4294800500, ack 4294802855, win 65535, options [nop,nop,TS val 590755094 ecr 590754861], length 60
14:48:20.499275 IP CLIENT IP.37567 > SERVER IP.443: Flags [P.], seq 6016:6068, ack 5970, win 65535, options [nop,nop,TS val 590969407 ecr 590969309], length 52
14:48:20.717058 IP SERVER IP.443 > CLIENT IP.37567: Flags [P.], seq 4294800568:4294800628, ack 4294802982, win 65535, options [nop,nop,TS val 590755095 ecr 590754861], length 60
14:48:20.743117 IP CLIENT IP.37567 > SERVER IP.443: Flags [P.], seq 6144:6196, ack 6097, win 65535, options [nop,nop,TS val 590969407 ecr 590969308], length 52
14:48:20.743177 IP CLIENT IP.37567 > SERVER IP.443: Flags [P.], seq 6272:7162, ack 6224, win 65535, options [nop,nop,TS val 590969407 ecr 590969307], length 890
14:48:20.743188 IP CLIENT IP.37567 > SERVER IP.443: Flags [P.], seq 6400:7290, ack 6351, win 65535, options [nop,nop,TS val 590969407 ecr 590969306], length 890
14:48:20.743195 IP CLIENT IP.37567 > SERVER IP.443: Flags [P.], seq 6528:7418, ack 6478, win 65535, options [nop,nop,TS val 590969407 ecr 590969305], length 890
14:48:21.380439 IP CLIENT IP.37567 > SERVER IP.443: Flags [P.], seq 6656:6716, ack 6605, win 65535, options [nop,nop,TS val 590969407 ecr 590969304], length 60
14:48:21.508932 IP SERVER IP.443 > CLIENT IP.37567: Flags [P.], seq 4294800696:4294800788, ack 4294803109, win 65535, options [nop,nop,TS val 590755095 ecr 590754860], length 92
14:48:21.532143 IP CLIENT IP.37567 > SERVER IP.443: Flags [P.], seq 6784:6836, ack 6732, win 65535, options [nop,nop,TS val 590969407 ecr 590969303], length 52
14:48:21.675972 IP SERVER IP.443 > CLIENT IP.37567: Flags [P.], seq 4294800824:4294800884, ack 4294803236, win 65535, options [nop,nop,TS val 590755095 ecr 590754859], length 60
14:48:21.683839 IP CLIENT IP.37567 > SERVER IP.443: Flags [P.], seq 6912:6964, ack 6859, win 65535, options [nop,nop,TS val 590969407 ecr 590969302], length 52
14:48:21.706270 IP SERVER IP.443 > CLIENT IP.37567: Flags [P.], seq 4294800952:4294801012, ack 4294803363, win 65535, options [nop,nop,TS val 590755095 ecr 590754858], length 60
14:48:21.709278 IP CLIENT IP.37567 > SERVER IP.443: Flags [P.], seq 7040:7124, ack 6986, win 65535, options [nop,nop,TS val 590969408 ecr 590969302], length 84
14:48:22.100483 IP CLIENT IP.37567 > SERVER IP.443: Flags [P.], seq 7168:8058, ack 7113, win 65535, options [nop,nop,TS val 590969408 ecr 590969301], length 890
14:48:22.103024 IP SERVER IP.443 > CLIENT IP.37567: Flags [P.], seq 4294801080:4294801140, ack 4294803490, win 65535, options [nop,nop,TS val 590755095 ecr 590754857], length 60
14:48:22.130893 IP CLIENT IP.37567 > SERVER IP.443: Flags [P.], seq 7296:7348, ack 7240, win 65535, options [nop,nop,TS val 590969408 ecr 590969300], length 52
14:48:22.152274 IP CLIENT IP.37567 > SERVER IP.443: Flags [P.], seq 7424:7484, ack 7367, win 65535, options [nop,nop,TS val 590969408 ecr 590969299], length 60
14:48:22.362179 IP CLIENT IP.37567 > SERVER IP.443: Flags [P.], seq 7552:7612, ack 7494, win 65535, options [nop,nop,TS val 590969408 ecr 590969298], length 60
14:48:22.498900 IP SERVER IP.443 > CLIENT IP.37567: Flags [P.], seq 4294801208:4294801268, ack 4294803617, win 65535, options [nop,nop,TS val 590755095 ecr 590754856], length 60
14:48:22.514531 IP CLIENT IP.37567 > SERVER IP.443: Flags [P.], seq 7680:7732, ack 7621, win 65535, options [nop,nop,TS val 590969408 ecr 590969297], length 52
14:48:23.394822 IP CLIENT IP.37567 > SERVER IP.443: Flags [P.], seq 7808:7868, ack 7748, win 65535, options [nop,nop,TS val 590969408 ecr 590969296], length 60
14:48:23.525416 IP SERVER IP.443 > CLIENT IP.37567: Flags [P.], seq 4294801336:4294801396, ack 4294803744, win 65535, options [nop,nop,TS val 590755095 ecr 590754855], length 60
14:48:23.546407 IP CLIENT IP.37567 > SERVER IP.443: Flags [P.], seq 7936:7988, ack 7875, win 65535, options [nop,nop,TS val 590969408 ecr 590969295], length 52
14:48:23.695010 IP CLIENT IP.37567 > SERVER IP.443: Flags [P.], seq 8064:8124, ack 8002, win 65535, options [nop,nop,TS val 590969409 ecr 590969295], length 60
14:48:23.712785 IP SERVER IP.443 > CLIENT IP.37567: Flags [P.], seq 4294801464:4294801524, ack 4294803871, win 65535, options [nop,nop,TS val 590755095 ecr 590754854], length 60
14:48:23.725450 IP CLIENT IP.37567 > SERVER IP.443: Flags [P.], seq 8192:8244, ack 8129, win 65535, options [nop,nop,TS val 590969409 ecr 590969294], length 52
14:48:24.022883 IP CLIENT IP.37567 > SERVER IP.443: Flags [P.], seq 8320:8380, ack 8256, win 65535, options [nop,nop,TS val 590969409 ecr 590969293], length 60
14:48:24.087174 IP SERVER IP.443 > CLIENT IP.37567: Flags [P.], seq 4294801592:4294801652, ack 4294803998, win 65535, options [nop,nop,TS val 590755096 ecr 590754854], length 60
14:48:24.087175 IP SERVER IP.443 > CLIENT IP.37567: Flags [P.], seq 4294801720:4294801812, ack 4294804125, win 65535, options [nop,nop,TS val 590755096 ecr 590754853], length 92
14:48:24.087175 IP SERVER IP.443 > CLIENT IP.37567: Flags [P.], seq 4294801848:4294801940, ack 4294804252, win 65535, options [nop,nop,TS val 590755096 ecr 590754852], length 92
14:48:24.087175 IP SERVER IP.443 > CLIENT IP.37567: Flags [P.], seq 4294801976:4294802068, ack 4294804379, win 65535, options [nop,nop,TS val 590755096 ecr 590754851], length 92
14:48:24.113898 IP CLIENT IP.37567 > SERVER IP.443: Flags [P.], seq 8448:8500, ack 8383, win 65535, options [nop,nop,TS val 590969409 ecr 590969292], length 52
14:48:24.165578 IP CLIENT IP.37567 > SERVER IP.443: Flags [P.], seq 8576:8636, ack 8510, win 65535, options [nop,nop,TS val 590969409 ecr 590969291], length 60
14:48:24.647442 IP SERVER IP.443 > CLIENT IP.37567: Flags [P.], seq 4294802104:4294802164, ack 4294804506, win 65535, options [nop,nop,TS val 590755096 ecr 590754850], length 60
14:48:24.650501 IP CLIENT IP.37567 > SERVER IP.443: Flags [P.], seq 8704:8756, ack 8637, win 65535, options [nop,nop,TS val 590969409 ecr 590969290], length 52
14:48:25.185233 IP CLIENT IP.37567 > SERVER IP.443: Flags [P.], seq 8832:9722, ack 8764, win 65535, options [nop,nop,TS val 590969409 ecr 590969289], length 890
14:48:25.395919 IP SERVER IP.443 > CLIENT IP.37567: Flags [P.], seq 4294802232:4294802292, ack 4294804633, win 65535, options [nop,nop,TS val 590755096 ecr 590754849], length 60
14:48:25.398037 IP CLIENT IP.37567 > SERVER IP.443: Flags [P.], seq 8960:9044, ack 8891, win 65535, options [nop,nop,TS val 590969409 ecr 590969288], length 84
14:48:25.516743 IP SERVER IP.443 > CLIENT IP.37567: Flags [P.], seq 4294802360:4294802420, ack 4294804760, win 65535, options [nop,nop,TS val 590755096 ecr 590754848], length 60
14:48:25.519338 IP CLIENT IP.37567 > SERVER IP.443: Flags [P.], seq 9088:9140, ack 9018, win 65535, options [nop,nop,TS val 590969410 ecr 590969288], length 52
14:48:25.519375 IP CLIENT IP.37567 > SERVER IP.443: Flags [P.], seq 9216:10106, ack 9145, win 65535, options [nop,nop,TS val 590969410 ecr 590969287], length 890
14:48:25.519406 IP CLIENT IP.37567 > SERVER IP.443: Flags [P.], seq 9344:10234, ack 9272, win 65535, options [nop,nop,TS val 590969410 ecr 590969286], length 890
14:48:25.519434 IP CLIENT IP.37567 > SERVER IP.443: Flags [P.], seq 9472:10362, ack 9399, win 65535, options [nop,nop,TS val 590969410 ecr 590969285], length 890
14:48:25.563947 IP CLIENT IP.37567 > SERVER IP.443: Flags [P.], seq 9600:9660, ack 9526, win 65535, options [nop,nop,TS val 590969410 ecr 590969284], length 60
14:48:25.704126 IP SERVER IP.443 > CLIENT IP.37567: Flags [P.], seq 4294802488:4294802548, ack 4294804887, win 65535, options [nop,nop,TS val 590755096 ecr 590754847], length 60
14:48:25.707381 IP CLIENT IP.37567 > SERVER IP.443: Flags [P.], seq 9728:9812, ack 9653, win 65535, options [nop,nop,TS val 590969410 ecr 590969283], length 84
14:48:26.008277 IP CLIENT IP.37567 > SERVER IP.443: Flags [P.], seq 9856:9916, ack 9780, win 65535, options [nop,nop,TS val 590969410 ecr 590969282], length 60
14:48:26.078664 IP SERVER IP.443 > CLIENT IP.37567: Flags [P.], seq 4294802616:4294802676, ack 4294805014, win 65535, options [nop,nop,TS val 590755097 ecr 590755047], length 60
14:48:26.099304 IP CLIENT IP.37567 > SERVER IP.443: Flags [P.], seq 9984:10036, ack 9907, win 65535, options [nop,nop,TS val 590969410 ecr 590969281], length 52
14:48:26.169218 IP CLIENT IP.37567 > SERVER IP.443: Flags [P.], seq 10112:10172, ack 10034, win 65535, options [nop,nop,TS val 590969411 ecr 590969281], length 60
14:48:26.330372 IP SERVER IP.443 > CLIENT IP.37567: Flags [P.], seq 4294802744:4294802804, ack 4294805141, win 65535, options [nop,nop,TS val 590755097 ecr 590755046], length 60
14:48:26.351109 IP CLIENT IP.37567 > SERVER IP.443: Flags [P.], seq 10240:10292, ack 10161, win 65535, options [nop,nop,TS val 590969411 ecr 590969280], length 52
14:48:26.639390 IP SERVER IP.443 > CLIENT IP.37567: Flags [P.], seq 4294802872:4294802932, ack 4294805268, win 65535, options [nop,nop,TS val 590755097 ecr 590755045], length 60
14:48:26.654232 IP CLIENT IP.37567 > SERVER IP.443: Flags [P.], seq 10368:10420, ack 10288, win 65535, options [nop,nop,TS val 590969411 ecr 590969279], length 52
14:48:27.106641 IP CLIENT IP.37567 > SERVER IP.443: Flags [P.], seq 10496:10556, ack 10415, win 65535, options [nop,nop,TS val 590969411 ecr 590969278], length 60
14:48:27.379536 IP CLIENT IP.37567 > SERVER IP.443: Flags [P.], seq 10624:10684, ack 10542, win 65535, options [nop,nop,TS val 590969411 ecr 590969277], length 60
14:48:27.387265 IP SERVER IP.443 > CLIENT IP.37567: Flags [P.], seq 4294803000:4294803060, ack 4294805395, win 65535, options [nop,nop,TS val 590755097 ecr 590755044], length 60
14:48:27.410036 IP CLIENT IP.37567 > SERVER IP.443: Flags [P.], seq 10752:10804, ack 10669, win 65535, options [nop,nop,TS val 590969411 ecr 590969276], length 52
14:48:27.410075 IP CLIENT IP.37567 > SERVER IP.443: Flags [P.], seq 10880:10964, ack 10796, win 65535, options [nop,nop,TS val 590969411 ecr 590969275], length 84
14:48:27.410085 IP CLIENT IP.37567 > SERVER IP.443: Flags [P.], seq 11008:11092, ack 10923, win 65535, options [nop,nop,TS val 590969411 ecr 590969274], length 84
14:48:27.410094 IP CLIENT IP.37567 > SERVER IP.443: Flags [P.], seq 11136:11220, ack 11050, win 65535, options [nop,nop,TS val 590969412 ecr 590969274], length 84
14:48:27.453055 IP SERVER IP.443 > CLIENT IP.37567: Flags [P.], seq 4294803128:4294803188, ack 4294805522, win 65535, options [nop,nop,TS val 590755097 ecr 590755043], length 60
14:48:27.470851 IP CLIENT IP.37567 > SERVER IP.443: Flags [P.], seq 11264:11316, ack 11177, win 65535, options [nop,nop,TS val 590969412 ecr 590969273], length 52
14:48:27.513723 IP SERVER IP.443 > CLIENT IP.37567: Flags [P.], seq 4294803256:4294803316, ack 4294805649, win 65535, options [nop,nop,TS val 590755097 ecr 590755042], length 60
14:48:27.513723 IP SERVER IP.443 > CLIENT IP.37567: Flags [P.], seq 4294803384:4294803444, ack 4294805776, win 65535, options [nop,nop,TS val 590755097 ecr 590755041], length 60
14:48:27.513723 IP SERVER IP.443 > CLIENT IP.37567: Flags [P.], seq 4294803512:4294803572, ack 4294805903, win 65535, options [nop,nop,TS val 590755097 ecr 590755040], length 60
14:48:27.513723 IP SERVER IP.443 > CLIENT IP.37567: Flags [P.], seq 4294803640:4294803700, ack 4294806030, win 65535, options [nop,nop,TS val 590755098 ecr 590755040], length 60
14:48:27.531446 IP CLIENT IP.37567 > SERVER IP.443: Flags [P.], seq 11392:11444, ack 11304, win 65535, options [nop,nop,TS val 590969412 ecr 590969272], length 52
14:48:27.701152 IP SERVER IP.443 > CLIENT IP.37567: Flags [P.], seq 4294803768:4294803828, ack 4294806157, win 65535, options [nop,nop,TS val 590755098 ecr 590755039], length 60
14:48:27.712209 IP CLIENT IP.37567 > SERVER IP.443: Flags [P.], seq 11520:11604, ack 11431, win 65535, options [nop,nop,TS val 590969412 ecr 590969271], length 84
14:48:28.021027 IP CLIENT IP.37567 > SERVER IP.443: Flags [P.], seq 11648:11708, ack 11558, win 65535, options [nop,nop,TS val 590969412 ecr 590969270], length 60
14:48:28.076140 IP SERVER IP.443 > CLIENT IP.37567: Flags [P.], seq 4294803896:4294803956, ack 4294806284, win 65535, options [nop,nop,TS val 590755098 ecr 590755038], length 60
14:48:28.082051 IP CLIENT IP.37567 > SERVER IP.443: Flags [P.], seq 11776:11828, ack 11685, win 65535, options [nop,nop,TS val 590969412 ecr 590969269], length 52
14:48:28.150857 IP CLIENT IP.37567 > SERVER IP.443: Flags [P.], seq 11904:11964, ack 11812, win 65535, options [nop,nop,TS val 590969412 ecr 590969268], length 60
14:48:28.277364 IP SERVER IP.443 > CLIENT IP.37567: Flags [P.], seq 4294804024:4294804076, ack 4294806411, win 65535, options [nop,nop,TS val 590755098 ecr 590755037], length 52
14:48:28.277945 IP CLIENT IP.37567 > SERVER IP.443: Flags [P.], seq 12032:13082, ack 11939, win 65535, options [nop,nop,TS val 590969412 ecr 590969267], length 1050
14:48:28.946116 IP CLIENT IP.37567 > SERVER IP.443: Flags [P.], seq 12160:13210, ack 12066, win 65535, options [nop,nop,TS val 590969413 ecr 590969267], length 1050
14:48:29.400797 IP CLIENT IP.37567 > SERVER IP.443: Flags [P.], seq 12288:12348, ack 12193, win 65535, options [nop,nop,TS val 590969413 ecr 590969266], length 60
14:48:29.525714 IP SERVER IP.443 > CLIENT IP.37567: Flags [P.], seq 4294804152:4294804212, ack 4294806538, win 65535, options [nop,nop,TS val 590755098 ecr 590755036], length 60
14:48:29.552463 IP CLIENT IP.37567 > SERVER IP.443: Flags [P.], seq 12416:12468, ack 12320, win 65535, options [nop,nop,TS val 590969413 ecr 590969265], length 52
14:48:29.552505 IP CLIENT IP.37567 > SERVER IP.443: Flags [P.], seq 12544:13594, ack 12447, win 65535, options [nop,nop,TS val 590969413 ecr 590969264], length 1050
14:48:29.552556 IP CLIENT IP.37567 > SERVER IP.443: Flags [P.], seq 12672:13722, ack 12574, win 65535, options [nop,nop,TS val 590969413 ecr 590969263], length 1050
14:48:29.552582 IP CLIENT IP.37567 > SERVER IP.443: Flags [P.], seq 12800:13850, ack 12701, win 65535, options [nop,nop,TS val 590969413 ecr 590969262], length 1050
14:48:29.712945 IP SERVER IP.443 > CLIENT IP.37567: Flags [P.], seq 4294804280:4294804340, ack 4294806665, win 65535, options [nop,nop,TS val 590755098 ecr 590755035], length 60
14:48:29.734816 IP CLIENT IP.37567 > SERVER IP.443: Flags [P.], seq 12928:12980, ack 12828, win 65535, options [nop,nop,TS val 590969413 ecr 590969261], length 52
14:48:30.068302 IP CLIENT IP.37567 > SERVER IP.443: Flags [P.], seq 13056:13116, ack 12955, win 65535, options [nop,nop,TS val 590969413 ecr 590969260], length 60
14:48:30.086459 IP SERVER IP.443 > CLIENT IP.37567: Flags [P.], seq 4294804408:4294804468, ack 4294806792, win 65535, options [nop,nop,TS val 590755098 ecr 590755034], length 60
14:48:30.098704 IP CLIENT IP.37567 > SERVER IP.443: Flags [P.], seq 13184:13236, ack 13082, win 65535, options [nop,nop,TS val 590969414 ecr 590969260], length 52
14:48:30.282746 IP CLIENT IP.37567 > SERVER IP.443: Flags [P.], seq 13312:14362, ack 13209, win 65535, options [nop,nop,TS val 590969414 ecr 590969259], length 1050
14:48:31.374531 IP CLIENT IP.37567 > SERVER IP.443: Flags [P.], seq 13440:13500, ack 13336, win 65535, options [nop,nop,TS val 590969414 ecr 590969258], length 60
14:48:31.404967 IP CLIENT IP.37567 > SERVER IP.443: Flags [P.], seq 13568:13628, ack 13463, win 65535, options [nop,nop,TS val 590969414 ecr 590969257], length 60
14:48:31.509716 IP SERVER IP.443 > CLIENT IP.37567: Flags [P.], seq 4294804536:4294804596, ack 4294806919, win 65535, options [nop,nop,TS val 590755098 ecr 590755033], length 60
14:48:31.526152 IP CLIENT IP.37567 > SERVER IP.443: Flags [P.], seq 13696:13748, ack 13590, win 65535, options [nop,nop,TS val 590969414 ecr 590969256], length 52
14:48:32.042918 IP CLIENT IP.37567 > SERVER IP.443: Flags [P.], seq 13824:13884, ack 13717, win 65535, options [nop,nop,TS val 590969414 ecr 590969255], length 60
14:48:32.286292 IP CLIENT IP.37567 > SERVER IP.443: Flags [P.], seq 13952:15002, ack 13844, win 65535, options [nop,nop,TS val 590969414 ecr 590969254], length 1050
14:48:33.379024 IP CLIENT IP.37567 > SERVER IP.443: Flags [P.], seq 14080:14172, ack 13971, win 65535, options [nop,nop,TS val 590969414 ecr 590969253], length 92
14:48:33.409525 IP CLIENT IP.37567 > SERVER IP.443: Flags [P.], seq 14208:14268, ack 14098, win 65535, options [nop,nop,TS val 590969415 ecr 590969253], length 60
14:48:34.046814 IP CLIENT IP.37567 > SERVER IP.443: Flags [P.], seq 14336:14396, ack 14225, win 65535, options [nop,nop,TS val 590969415 ecr 590969252], length 60
```

** Server tcpdump **
```
11:18:15.457048 IP CLIENT_IP.37567 > SERVER_IP.443: Flags [P.], seq 590969657:590970079, ack 590971055, win 65535, options [nop,nop,TS val 590969401 ecr 590969349], length 422
11:18:15.457980 IP SERVER_IP.443 > CLIENT_IP.37567: Flags [P.], seq 4294791993:4294792045, ack 4294794472, win 65535, options [nop,nop,TS val 590755086 ecr 590754918], length 52
11:18:15.578070 IP CLIENT_IP.37567 > SERVER_IP.443: Flags [P.], seq 128:1289, ack 128, win 65535, options [nop,nop,TS val 590969401 ecr 590969348], length 1161
11:18:15.579099 IP SERVER_IP.443 > CLIENT_IP.37567: Flags [P.], seq 4294792121:4294792237, ack 4294794599, win 65535, options [nop,nop,TS val 590755086 ecr 590754917], length 116
11:18:15.609109 IP SERVER_IP.443 > CLIENT_IP.37567: Flags [P.], seq 4294792249:4294792373, ack 4294794726, win 65535, options [nop,nop,TS val 590755087 ecr 590754917], length 124
11:18:15.686337 IP CLIENT_IP.37567 > SERVER_IP.443: Flags [P.], seq 256:308, ack 255, win 65535, options [nop,nop,TS val 590969401 ecr 590969347], length 52
11:18:15.729876 IP CLIENT_IP.37567 > SERVER_IP.443: Flags [P.], seq 384:436, ack 382, win 65535, options [nop,nop,TS val 590969401 ecr 590969346], length 52
11:18:15.730138 IP SERVER_IP.443 > CLIENT_IP.37567: Flags [P.], seq 4294792377:4294792518, ack 4294794853, win 65535, options [nop,nop,TS val 590755087 ecr 590754916], length 141
11:18:15.761209 IP SERVER_IP.443 > CLIENT_IP.37567: Flags [P.], seq 4294792505:4294792654, ack 4294794980, win 65535, options [nop,nop,TS val 590755087 ecr 590754915], length 149
11:18:15.850764 IP CLIENT_IP.37567 > SERVER_IP.443: Flags [P.], seq 512:628, ack 509, win 65535, options [nop,nop,TS val 590969401 ecr 590969345], length 116
11:18:15.851090 IP SERVER_IP.443 > CLIENT_IP.37567: Flags [P.], seq 4294792633:4294792685, ack 4294795107, win 65535, options [nop,nop,TS val 590755087 ecr 590754914], length 52
11:18:15.881127 IP CLIENT_IP.37567 > SERVER_IP.443: Flags [P.], seq 640:692, ack 636, win 65535, options [nop,nop,TS val 590969401 ecr 590969344], length 52
11:18:15.942304 IP CLIENT_IP.37567 > SERVER_IP.443: Flags [P.], seq 768:907, ack 763, win 65535, options [nop,nop,TS val 590969402 ecr 590969344], length 139
11:18:15.942605 IP SERVER_IP.443 > CLIENT_IP.37567: Flags [P.], seq 4294792761:4294792813, ack 4294795234, win 65535, options [nop,nop,TS val 590755087 ecr 590754913], length 52
11:18:15.958178 IP CLIENT_IP.37567 > SERVER_IP.443: Flags [P.], seq 896:1566, ack 890, win 65535, options [nop,nop,TS val 590969402 ecr 590969343], length 670
11:18:15.973407 IP SERVER_IP.443 > CLIENT_IP.37567: Flags [P.], seq 4294792889:4294793528, ack 4294795361, win 65535, options [nop,nop,TS val 590755087 ecr 590754912], length 639
11:18:16.080880 IP CLIENT_IP.37567 > SERVER_IP.443: Flags [P.], seq 1024:1076, ack 1017, win 65535, options [nop,nop,TS val 590969402 ecr 590969342], length 52
11:18:16.080939 IP CLIENT_IP.37567 > SERVER_IP.443: Flags [P.], seq 1152:2313, ack 1144, win 65535, options [nop,nop,TS val 590969402 ecr 590969341], length 1161
11:18:16.081212 IP SERVER_IP.443 > CLIENT_IP.37567: Flags [P.], seq 4294793017:4294793146, ack 4294795488, win 65535, options [nop,nop,TS val 590755087 ecr 590754911], length 129
11:18:16.094559 IP SERVER_IP.443 > CLIENT_IP.37567: Flags [P.], seq 4294793145:4294793197, ack 4294795615, win 65535, options [nop,nop,TS val 590755087 ecr 590754910], length 52
11:18:16.094580 IP SERVER_IP.443 > CLIENT_IP.37567: Flags [P.], seq 4294793273:4294793912, ack 4294795742, win 65535, options [nop,nop,TS val 590755088 ecr 590754910], length 639
11:18:16.094591 IP SERVER_IP.443 > CLIENT_IP.37567: Flags [P.], seq 4294793401:4294794040, ack 4294795869, win 65535, options [nop,nop,TS val 590755088 ecr 590754909], length 639
11:18:16.094597 IP SERVER_IP.443 > CLIENT_IP.37567: Flags [P.], seq 4294793529:4294794168, ack 4294795996, win 65535, options [nop,nop,TS val 590755088 ecr 590754908], length 639
11:18:16.124946 IP SERVER_IP.443 > CLIENT_IP.37567: Flags [P.], seq 4294793657:4294793824, ack 4294796123, win 65535, options [nop,nop,TS val 590755088 ecr 590754907], length 167
11:18:16.124974 IP SERVER_IP.443 > CLIENT_IP.37567: Flags [P.], seq 4294793785:4294795135, ack 4294796250, win 65535, options [nop,nop,TS val 590755088 ecr 590754906], length 1350
11:18:16.124986 IP SERVER_IP.443 > CLIENT_IP.37567: Flags [P.], seq 4294793913:4294795263, ack 4294796377, win 65535, options [nop,nop,TS val 590755088 ecr 590754905], length 1350
11:18:16.124995 IP SERVER_IP.443 > CLIENT_IP.37567: Flags [P.], seq 4294794041:4294794520, ack 4294796504, win 65535, options [nop,nop,TS val 590755088 ecr 590754904], length 479
11:18:16.125003 IP SERVER_IP.443 > CLIENT_IP.37567: Flags [P.], seq 4294794169:4294795519, ack 4294796631, win 65535, options [nop,nop,TS val 590755088 ecr 590754903], length 1350
11:18:16.125011 IP SERVER_IP.443 > CLIENT_IP.37567: Flags [P.], seq 4294794297:4294795647, ack 4294796758, win 65535, options [nop,nop,TS val 590755089 ecr 590754903], length 1350
11:18:16.125051 IP SERVER_IP.443 > CLIENT_IP.37567: Flags [P.], seq 4294794425:4294795542, ack 4294796885, win 65535, options [nop,nop,TS val 590755089 ecr 590754902], length 1117
11:18:16.279320 IP SERVER_IP.443 > CLIENT_IP.37567: Flags [P.], seq 4294794553:4294794682, ack 4294797012, win 65535, options [nop,nop,TS val 590755089 ecr 590754901], length 129
11:18:16.322919 IP SERVER_IP.443 > CLIENT_IP.37567: Flags [P.], seq 4294794681:4294794848, ack 4294797139, win 65535, options [nop,nop,TS val 590755089 ecr 590754900], length 167
11:18:16.322955 IP SERVER_IP.443 > CLIENT_IP.37567: Flags [P.], seq 4294794809:4294796159, ack 4294797266, win 65535, options [nop,nop,TS val 590755089 ecr 590754899], length 1350
11:18:16.322968 IP SERVER_IP.443 > CLIENT_IP.37567: Flags [P.], seq 4294794937:4294796287, ack 4294797393, win 65535, options [nop,nop,TS val 590755089 ecr 590754898], length 1350
11:18:16.322977 IP SERVER_IP.443 > CLIENT_IP.37567: Flags [P.], seq 4294795065:4294796415, ack 4294797520, win 65535, options [nop,nop,TS val 590755089 ecr 590754897], length 1350
11:18:16.322985 IP SERVER_IP.443 > CLIENT_IP.37567: Flags [P.], seq 4294795193:4294796543, ack 4294797647, win 65535, options [nop,nop,TS val 590755089 ecr 590754896], length 1350
11:18:16.322992 IP SERVER_IP.443 > CLIENT_IP.37567: Flags [P.], seq 4294795321:4294796671, ack 4294797774, win 65535, options [nop,nop,TS val 590755090 ecr 590754896], length 1350
11:18:16.323000 IP SERVER_IP.443 > CLIENT_IP.37567: Flags [P.], seq 4294795449:4294795928, ack 4294797901, win 65535, options [nop,nop,TS val 590755090 ecr 590754895], length 479
11:18:16.323008 IP SERVER_IP.443 > CLIENT_IP.37567: Flags [P.], seq 4294795577:4294796927, ack 4294798028, win 65535, options [nop,nop,TS val 590755090 ecr 590754894], length 1350
11:18:16.323018 IP SERVER_IP.443 > CLIENT_IP.37567: Flags [P.], seq 4294795705:4294797055, ack 4294798155, win 65535, options [nop,nop,TS val 590755090 ecr 590754893], length 1350
11:18:16.323031 IP SERVER_IP.443 > CLIENT_IP.37567: Flags [P.], seq 4294795833:4294796950, ack 4294798282, win 65535, options [nop,nop,TS val 590755090 ecr 590754892], length 1117
11:18:16.675576 IP SERVER_IP.443 > CLIENT_IP.37567: Flags [P.], seq 4294795961:4294796090, ack 4294798409, win 65535, options [nop,nop,TS val 590755090 ecr 590754891], length 129
11:18:16.719121 IP SERVER_IP.443 > CLIENT_IP.37567: Flags [P.], seq 4294796089:4294796256, ack 4294798536, win 65535, options [nop,nop,TS val 590755090 ecr 590754890], length 167
11:18:16.719151 IP SERVER_IP.443 > CLIENT_IP.37567: Flags [P.], seq 4294796217:4294797567, ack 4294798663, win 65535, options [nop,nop,TS val 590755090 ecr 590754889], length 1350
11:18:16.719161 IP SERVER_IP.443 > CLIENT_IP.37567: Flags [P.], seq 4294796345:4294797695, ack 4294798790, win 65535, options [nop,nop,TS val 590755091 ecr 590754889], length 1350
11:18:16.719167 IP SERVER_IP.443 > CLIENT_IP.37567: Flags [P.], seq 4294796473:4294796952, ack 4294798917, win 65535, options [nop,nop,TS val 590755091 ecr 590754888], length 479
11:18:16.719173 IP SERVER_IP.443 > CLIENT_IP.37567: Flags [P.], seq 4294796601:4294797951, ack 4294799044, win 65535, options [nop,nop,TS val 590755091 ecr 590754887], length 1350
11:18:16.719181 IP SERVER_IP.443 > CLIENT_IP.37567: Flags [P.], seq 4294796729:4294798079, ack 4294799171, win 65535, options [nop,nop,TS val 590755091 ecr 590754886], length 1350
11:18:16.719187 IP SERVER_IP.443 > CLIENT_IP.37567: Flags [P.], seq 4294796857:4294798207, ack 4294799298, win 65535, options [nop,nop,TS val 590755091 ecr 590754885], length 1350
11:18:16.719197 IP SERVER_IP.443 > CLIENT_IP.37567: Flags [P.], seq 4294796985:4294798335, ack 4294799425, win 65535, options [nop,nop,TS val 590755091 ecr 590754884], length 1350
11:18:16.719206 IP SERVER_IP.443 > CLIENT_IP.37567: Flags [P.], seq 4294797113:4294798463, ack 4294799552, win 65535, options [nop,nop,TS val 590755091 ecr 590754883], length 1350
11:18:16.719212 IP SERVER_IP.443 > CLIENT_IP.37567: Flags [P.], seq 4294797241:4294798358, ack 4294799679, win 65535, options [nop,nop,TS val 590755091 ecr 590754882], length 1117
11:18:17.270046 IP SERVER_IP.443 > CLIENT_IP.37567: Flags [P.], seq 4294797369:4294797498, ack 4294799806, win 65535, options [nop,nop,TS val 590755092 ecr 590754882], length 129
11:18:17.312560 IP SERVER_IP.443 > CLIENT_IP.37567: Flags [P.], seq 4294797497:4294797664, ack 4294799933, win 65535, options [nop,nop,TS val 590755092 ecr 590754881], length 167
11:18:17.312582 IP SERVER_IP.443 > CLIENT_IP.37567: Flags [P.], seq 4294797625:4294798975, ack 4294800060, win 65535, options [nop,nop,TS val 590755092 ecr 590754880], length 1350
11:18:17.312594 IP SERVER_IP.443 > CLIENT_IP.37567: Flags [P.], seq 4294797753:4294799103, ack 4294800187, win 65535, options [nop,nop,TS val 590755092 ecr 590754879], length 1350
11:18:17.312601 IP SERVER_IP.443 > CLIENT_IP.37567: Flags [P.], seq 4294797881:4294798360, ack 4294800314, win 65535, options [nop,nop,TS val 590755092 ecr 590754878], length 479
11:18:17.312608 IP SERVER_IP.443 > CLIENT_IP.37567: Flags [P.], seq 4294798009:4294799359, ack 4294800441, win 65535, options [nop,nop,TS val 590755092 ecr 590754877], length 1350
11:18:17.312616 IP SERVER_IP.443 > CLIENT_IP.37567: Flags [P.], seq 4294798137:4294799487, ack 4294800568, win 65535, options [nop,nop,TS val 590755092 ecr 590754876], length 1350
11:18:17.312672 IP SERVER_IP.443 > CLIENT_IP.37567: Flags [P.], seq 4294798265:4294799615, ack 4294800695, win 65535, options [nop,nop,TS val 590755092 ecr 590754875], length 1350
11:18:17.312690 IP SERVER_IP.443 > CLIENT_IP.37567: Flags [P.], seq 4294798393:4294799743, ack 4294800822, win 65535, options [nop,nop,TS val 590755093 ecr 590754875], length 1350
11:18:17.312703 IP SERVER_IP.443 > CLIENT_IP.37567: Flags [P.], seq 4294798521:4294799871, ack 4294800949, win 65535, options [nop,nop,TS val 590755093 ecr 590754874], length 1350
11:18:17.312711 IP SERVER_IP.443 > CLIENT_IP.37567: Flags [P.], seq 4294798649:4294799766, ack 4294801076, win 65535, options [nop,nop,TS val 590755093 ecr 590754873], length 1117
11:18:17.408674 IP CLIENT_IP.37567 > SERVER_IP.443: Flags [P.], seq 3328:3587, ack 3303, win 65535, options [nop,nop,TS val 590969404 ecr 590969326], length 259
11:18:17.423448 IP SERVER_IP.443 > CLIENT_IP.37567: Flags [P.], seq 4294798777:4294798853, ack 4294801203, win 65535, options [nop,nop,TS val 590755093 ecr 590754872], length 76
11:18:17.463994 IP SERVER_IP.443 > CLIENT_IP.37567: Flags [P.], seq 4294798905:4294798965, ack 4294801330, win 65535, options [nop,nop,TS val 590755093 ecr 590754871], length 60
11:18:17.661540 IP SERVER_IP.443 > CLIENT_IP.37567: Flags [P.], seq 4294799033:4294799093, ack 4294801457, win 65535, options [nop,nop,TS val 590755093 ecr 590754870], length 60
11:18:18.058337 IP SERVER_IP.443 > CLIENT_IP.37567: Flags [P.], seq 4294799161:4294799221, ack 4294801584, win 65535, options [nop,nop,TS val 590755093 ecr 590754869], length 60
11:18:18.653379 IP SERVER_IP.443 > CLIENT_IP.37567: Flags [P.], seq 4294799289:4294799349, ack 4294801711, win 65535, options [nop,nop,TS val 590755093 ecr 590754868], length 60
11:18:19.446315 IP SERVER_IP.443 > CLIENT_IP.37567: Flags [P.], seq 4294799417:4294799477, ack 4294801838, win 65535, options [nop,nop,TS val 590755094 ecr 590754868], length 60
11:18:19.476802 IP SERVER_IP.443 > CLIENT_IP.37567: Flags [P.], seq 4294799545:4294799605, ack 4294801965, win 65535, options [nop,nop,TS val 590755094 ecr 590754867], length 60
11:18:19.675335 IP SERVER_IP.443 > CLIENT_IP.37567: Flags [P.], seq 4294799673:4294799733, ack 4294802092, win 65535, options [nop,nop,TS val 590755094 ecr 590754866], length 60
11:18:20.072116 IP SERVER_IP.443 > CLIENT_IP.37567: Flags [P.], seq 4294799801:4294799861, ack 4294802219, win 65535, options [nop,nop,TS val 590755094 ecr 590754865], length 60
11:18:20.072146 IP SERVER_IP.443 > CLIENT_IP.37567: Flags [P.], seq 4294799929:4294801046, ack 4294802346, win 65535, options [nop,nop,TS val 590755094 ecr 590754864], length 1117
11:18:20.072157 IP SERVER_IP.443 > CLIENT_IP.37567: Flags [P.], seq 4294800057:4294801174, ack 4294802473, win 65535, options [nop,nop,TS val 590755094 ecr 590754863], length 1117
11:18:20.072168 IP SERVER_IP.443 > CLIENT_IP.37567: Flags [P.], seq 4294800185:4294801302, ack 4294802600, win 65535, options [nop,nop,TS val 590755094 ecr 590754862], length 1117
11:18:20.436550 IP SERVER_IP.443 > CLIENT_IP.37567: Flags [P.], seq 4294800313:4294800373, ack 4294802727, win 65535, options [nop,nop,TS val 590755094 ecr 590754861], length 60
11:18:20.666134 IP SERVER_IP.443 > CLIENT_IP.37567: Flags [P.], seq 4294800441:4294800501, ack 4294802854, win 65535, options [nop,nop,TS val 590755095 ecr 590754861], length 60
11:18:21.458019 IP SERVER_IP.443 > CLIENT_IP.37567: Flags [P.], seq 4294800569:4294800661, ack 4294802981, win 65535, options [nop,nop,TS val 590755095 ecr 590754860], length 92
11:18:21.625161 IP SERVER_IP.443 > CLIENT_IP.37567: Flags [P.], seq 4294800697:4294800757, ack 4294803108, win 65535, options [nop,nop,TS val 590755095 ecr 590754859], length 60
11:18:21.655429 IP SERVER_IP.443 > CLIENT_IP.37567: Flags [P.], seq 4294800825:4294800885, ack 4294803235, win 65535, options [nop,nop,TS val 590755095 ecr 590754858], length 60
11:18:22.052157 IP SERVER_IP.443 > CLIENT_IP.37567: Flags [P.], seq 4294800953:4294801013, ack 4294803362, win 65535, options [nop,nop,TS val 590755095 ecr 590754857], length 60
11:18:22.447929 IP SERVER_IP.443 > CLIENT_IP.37567: Flags [P.], seq 4294801081:4294801141, ack 4294803489, win 65535, options [nop,nop,TS val 590755095 ecr 590754856], length 60
11:18:22.570271 IP CLIENT_IP.37567 > SERVER_IP.443: Flags [P.], seq 7552:7604, ack 7494, win 65535, options [nop,nop,TS val 590969408 ecr 590969297], length 52
11:18:23.474528 IP SERVER_IP.443 > CLIENT_IP.37567: Flags [P.], seq 4294801209:4294801269, ack 4294803616, win 65535, options [nop,nop,TS val 590755095 ecr 590754855], length 60
11:18:23.661877 IP SERVER_IP.443 > CLIENT_IP.37567: Flags [P.], seq 4294801337:4294801397, ack 4294803743, win 65535, options [nop,nop,TS val 590755095 ecr 590754854], length 60
11:18:24.036157 IP SERVER_IP.443 > CLIENT_IP.37567: Flags [P.], seq 4294801465:4294801525, ack 4294803870, win 65535, options [nop,nop,TS val 590755096 ecr 590754854], length 60
11:18:24.036182 IP SERVER_IP.443 > CLIENT_IP.37567: Flags [P.], seq 4294801593:4294801685, ack 4294803997, win 65535, options [nop,nop,TS val 590755096 ecr 590754853], length 92
11:18:24.036187 IP SERVER_IP.443 > CLIENT_IP.37567: Flags [P.], seq 4294801721:4294801813, ack 4294804124, win 65535, options [nop,nop,TS val 590755096 ecr 590754852], length 92
11:18:24.036192 IP SERVER_IP.443 > CLIENT_IP.37567: Flags [P.], seq 4294801849:4294801941, ack 4294804251, win 65535, options [nop,nop,TS val 590755096 ecr 590754851], length 92
11:18:24.596479 IP SERVER_IP.443 > CLIENT_IP.37567: Flags [P.], seq 4294801977:4294802037, ack 4294804378, win 65535, options [nop,nop,TS val 590755096 ecr 590754850], length 60
11:18:25.344988 IP SERVER_IP.443 > CLIENT_IP.37567: Flags [P.], seq 4294802105:4294802165, ack 4294804505, win 65535, options [nop,nop,TS val 590755096 ecr 590754849], length 60
11:18:25.465939 IP SERVER_IP.443 > CLIENT_IP.37567: Flags [P.], seq 4294802233:4294802293, ack 4294804632, win 65535, options [nop,nop,TS val 590755096 ecr 590754848], length 60
11:18:25.653228 IP SERVER_IP.443 > CLIENT_IP.37567: Flags [P.], seq 4294802361:4294802421, ack 4294804759, win 65535, options [nop,nop,TS val 590755096 ecr 590754847], length 60
11:18:26.027789 IP SERVER_IP.443 > CLIENT_IP.37567: Flags [P.], seq 4294802489:4294802549, ack 4294804886, win 65535, options [nop,nop,TS val 590755097 ecr 590755047], length 60
11:18:26.279479 IP SERVER_IP.443 > CLIENT_IP.37567: Flags [P.], seq 4294802617:4294802677, ack 4294805013, win 65535, options [nop,nop,TS val 590755097 ecr 590755046], length 60
11:18:26.588575 IP SERVER_IP.443 > CLIENT_IP.37567: Flags [P.], seq 4294802745:4294802805, ack 4294805140, win 65535, options [nop,nop,TS val 590755097 ecr 590755045], length 60
11:18:27.336416 IP SERVER_IP.443 > CLIENT_IP.37567: Flags [P.], seq 4294802873:4294802933, ack 4294805267, win 65535, options [nop,nop,TS val 590755097 ecr 590755044], length 60
11:18:27.402050 IP SERVER_IP.443 > CLIENT_IP.37567: Flags [P.], seq 4294803001:4294803061, ack 4294805394, win 65535, options [nop,nop,TS val 590755097 ecr 590755043], length 60
11:18:27.462763 IP SERVER_IP.443 > CLIENT_IP.37567: Flags [P.], seq 4294803129:4294803189, ack 4294805521, win 65535, options [nop,nop,TS val 590755097 ecr 590755042], length 60
11:18:27.462790 IP SERVER_IP.443 > CLIENT_IP.37567: Flags [P.], seq 4294803257:4294803317, ack 4294805648, win 65535, options [nop,nop,TS val 590755097 ecr 590755041], length 60
11:18:27.462796 IP SERVER_IP.443 > CLIENT_IP.37567: Flags [P.], seq 4294803385:4294803445, ack 4294805775, win 65535, options [nop,nop,TS val 590755097 ecr 590755040], length 60
11:18:27.462801 IP SERVER_IP.443 > CLIENT_IP.37567: Flags [P.], seq 4294803513:4294803573, ack 4294805902, win 65535, options [nop,nop,TS val 590755098 ecr 590755040], length 60
11:18:27.650307 IP SERVER_IP.443 > CLIENT_IP.37567: Flags [P.], seq 4294803641:4294803701, ack 4294806029, win 65535, options [nop,nop,TS val 590755098 ecr 590755039], length 60
11:18:28.025047 IP SERVER_IP.443 > CLIENT_IP.37567: Flags [P.], seq 4294803769:4294803829, ack 4294806156, win 65535, options [nop,nop,TS val 590755098 ecr 590755038], length 60
11:18:28.206574 IP CLIENT_IP.37567 > SERVER_IP.443: Flags [P.], seq 11776:11836, ack 11685, win 65535, options [nop,nop,TS val 590969412 ecr 590969268], length 60
11:18:28.226343 IP SERVER_IP.443 > CLIENT_IP.37567: Flags [P.], seq 4294803897:4294803949, ack 4294806283, win 65535, options [nop,nop,TS val 590755098 ecr 590755037], length 52
11:18:29.474857 IP SERVER_IP.443 > CLIENT_IP.37567: Flags [P.], seq 4294804025:4294804085, ack 4294806410, win 65535, options [nop,nop,TS val 590755098 ecr 590755036], length 60
11:18:29.662114 IP SERVER_IP.443 > CLIENT_IP.37567: Flags [P.], seq 4294804153:4294804213, ack 4294806537, win 65535, options [nop,nop,TS val 590755098 ecr 590755035], length 60
11:18:30.035492 IP SERVER_IP.443 > CLIENT_IP.37567: Flags [P.], seq 4294804281:4294804341, ack 4294806664, win 65535, options [nop,nop,TS val 590755098 ecr 590755034], length 60
11:18:30.154339 IP CLIENT_IP.37567 > SERVER_IP.443: Flags [P.], seq 13056:13108, ack 12955, win 65535, options [nop,nop,TS val 590969414 ecr 590969260], length 52
11:18:31.458829 IP SERVER_IP.443 > CLIENT_IP.37567: Flags [P.], seq 4294804409:4294804469, ack 4294806791, win 65535, options [nop,nop,TS val 590755098 ecr 590755033], length 60

```

**Comment by NotABaguette** [comment]
> [@NotABaguette](https://github.com/NotABaguette) Do not use ports 80, 443, or any other standard ports, because iptables rules can also affect outgoing connections from the server. For example, connections from the server to httpbin.org could be impacted.

Changed that to 8845, 7234 9999 9741,
Right now 8845 is working in random orders.

**Comment by hanselime** [comment]
You still have to use whatever IP the gateway/router assigns to you. It doesn't matter whether you have a static or dynamic public IP. I'm not exactly sure how your router is set up, but you can always get this information using tcpdump.

For example, run:
`tcpdump -i eth0 host 1.0.0.1 -n -e
`
Then run `ping 1.0.0.1` or `nc 1.0.0.1 53`.

This will show your source IP (local IP) and the destination MAC address (the router's MAC address). These values should match what's in your config file.

**Comment by hanselime** [comment]
@mfoolady @sMwHere @NotABaguette @AmirKasraKashani @SaeedDev94 

Can you all test this [build](https://github.com/hanselime/paqet/actions/runs/21642240752#artifacts) to see if it made any difference in stability?

**Comment by nekooee** [comment]
I tested with version v1.0.0-alpha.15 as well, but on my client in the datacenter running AlmaLinux it still only works with the S and SA flags. On my Windows system with a home internet connection, it connects without any issues using P and PA and with much higher speed. It seems the problem is related to connectivity from datacenters.

**Comment by hanselime** [comment]
@nekooee @SaeedDev94 @mfoolady @NotABaguette @AmirKasraKashani @sMwHere 

Please test this [PR](https://github.com/hanselime/paqet/pull/77) if you can. the build is available [here](https://github.com/hanselime/paqet/actions/runs/21822456405#artifacts). let me know how it works, especially from setups where previously only 'S' or 'SA' packets were working.

**Note: this requires a public IP on both client and server and will not work behind NAT.**

https://github.com/hanselime/paqet/pull/77

**Comment by nekooee** [comment]
> [@nekooee](https://github.com/nekooee) [@SaeedDev94](https://github.com/SaeedDev94) [@mfoolady](https://github.com/mfoolady) [@NotABaguette](https://github.com/NotABaguette) [@AmirKasraKashani](https://github.com/AmirKasraKashani) [@sMwHere](https://github.com/sMwHere)
> 
> Please test this [PR](https://github.com/hanselime/paqet/pull/77) if you can. the build is available [here](https://github.com/hanselime/paqet/actions/runs/21822456405#artifacts). let me know how it works, especially from setups where previously only 'S' or 'SA' packets were working.
> 
> **Note: this requires a public IP on both client and server and will not work behind NAT.**
> 
> [#77](https://github.com/hanselime/paqet/pull/77)

The fact that it no longer has connectivity from a home internet connection is itself a problem. In any case, I need to build it myself for testing because your builds are not compatible with AlmaLinux 8, and I need some free time to do that. I hope others can run the tests sooner than I can and share the results.

**Comment by NightMachinery** [comment]
> hanselime/paqet/actions/runs/21894636068#artifacts

The build artifact have expired. As someone said, perhaps you can mark them as a pre-release.
